QnA,Tourisme - loisir - culture - sport,Quelle distance faudra respecter entre personnes?,plop,"La distanciation physique veut dire de garder une certaine distance entre vous et les autres. Comme la COVID‑19 se transmet surtout par des contacts rapprochés avec des personnes infectées, il s'agit d’un des moyens les plus efficaces pour réduire la propagation de la maladie. Afin de réduire au minimum le nombre de contacts rapprochés avec d’autres personnes qui sont infectées, il faut : *   Rester à la maison le plus possible; *   Cesser les rassemblements non essentiels avec d’autres personnes que celles vivant sous votre toit (par exemple, des soupers entre amis); *   Éviter les contacts physiques avec les personnes les plus à risque de complications (aînés, personnes atteintes de maladies chroniques et ayant le système immunitaire affaibli); *   Si vous devez sortir, maintenez autant que possible une distance d’au moins 2 mètres (environ 6 pieds) avec les autres."
QnA,Tourisme - loisir - culture - sport,"Des occupants viennent de quitter ma résidence de tourisme. Quelles sont les mesures préventives à prendre afin de nous protéger, ma famille et moi, de la COVID-19?",plop,"Le coronavirus (COVID-19) peut vivre sur les objets et les surfaces de quelques heures à quelques jours. *   de 3 heures sur les objets avec surfaces sèches; *   de 6 jours sur les objets avec surfaces humides. Il est donc important que vous laviez les comptoirs, les lavabos, les poignées de porte et toutes les surfaces fréquemment touchées par les mains. Le nettoyage et la désinfection sont très efficaces pour éliminer le virus. À cet effet, utilisez de l’eau et du savon ou des produits de nettoyage à usage domestique et une solution désinfectante. Pour plus d’information, consultez le [_Guide autosoins_]( ) ."
QnA,Tourisme - loisir - culture - sport,Le confinement demandé par le gouvernement a-t-il une incidence sur le fonctionnement et les services du ministère du Tourisme ?,plop,"Les activités du ministère du Tourisme se poursuivent afin de bien soutenir l’industrie. Conformément aux directives de santé publique, la majorité du personnel assure sa prestation de services en télétravail. En vue de faciliter le traitement des dossiers, les entreprises touristiques sont invitées à transmettre tous les documents par courrier électronique, y compris les conventions d’aide financière en cours de signature. En raison de la crise sanitaire actuelle, le centre d’appels et les centres Infotouriste sont fermés jusqu’à nouvel ordre. Les sociétés d’État sous la responsabilité du Ministère, soit la Régie des installations olympiques, le Palais des congrès de Montréal et Centre des congrès de Québec, ont également cessé leurs activités accueillant le public."
QnA,Tourisme - loisir - culture - sport,Les centres de plein air sont-ils ouvert?,plop,"Le gouvernement du Québec a demandé aux propriétaires des restaurants de fermer leurs salles à manger. Les commandes pour emporter, les livraisons et les services à l’auto demeurent permis."
QnA,Tourisme - loisir - culture - sport,À qui doivent s’adresser les propriétaires hôteliers qui souhaitent offrir leurs services pour accueillir des personnes dans le besoin?,plop,"Les autorités publiques travaillent à établir des critères précis quant au choix des établissements. En premier lieu, les autorités de la santé publique contacteront directement les hôteliers appelés à collaborer; cette mesure évoluera en fonction de la situation. Dès que les ententes seront confirmées avec les hôteliers concernés, les autorités de la santé publique prendront en charge les protocoles. Pour obtenir plus d’informations, vous pouvez joindre l’Association Hôtellerie Québec, qui est responsable de la gestion de la liste des établissements hôteliers. Vous pouvez communiquer votre offre d’hébergement à [admin@hotelleriequebec.com](mailto:admin@hotelleriequebec.com)."
QnA,Tourisme - loisir - culture - sport,Les demandes d’aide financière déposées auprès du Ministère seront-elles traitées selon les délais habituels?,plop,L’analyse des demandes d’aide financière se poursuit malgré la pandémie. Les réponses devraient être transmises au cours des prochaines semaines.
QnA,Tourisme - loisir - culture - sport,puis-je faire du vélo?,plop,"Oui, en solitaire. Cependant, les mêmes consignes relatives aux déplacements s’appliquent, c’est-à-dire que ceux-ci devraient se limiter à des raisons médicales et pour le travail, dans un contexte où le télétravail n'est pas possible."
QnA,Tourisme - loisir - culture - sport,Je cherche les mesures préventives pour ma maison que je loue,plop,"Le coronavirus (COVID-19) peut vivre sur les objets et les surfaces de quelques heures à quelques jours. *   de 3 heures sur les objets avec surfaces sèches; *   de 6 jours sur les objets avec surfaces humides. Il est donc important que vous laviez les comptoirs, les lavabos, les poignées de porte et toutes les surfaces fréquemment touchées par les mains. Le nettoyage et la désinfection sont très efficaces pour éliminer le virus. À cet effet, utilisez de l’eau et du savon ou des produits de nettoyage à usage domestique et une solution désinfectante. Pour plus d’information, consultez le [_Guide autosoins_]( ) ."
QnA,Tourisme - loisir - culture - sport,Est-ce que les employés du ministère du Tourisme travaillent actuellement ?,plop,"Les activités du ministère du Tourisme se poursuivent afin de bien soutenir l’industrie. Conformément aux directives de santé publique, la majorité du personnel assure sa prestation de services en télétravail. En vue de faciliter le traitement des dossiers, les entreprises touristiques sont invitées à transmettre tous les documents par courrier électronique, y compris les conventions d’aide financière en cours de signature. En raison de la crise sanitaire actuelle, le centre d’appels et les centres Infotouriste sont fermés jusqu’à nouvel ordre. Les sociétés d’État sous la responsabilité du Ministère, soit la Régie des installations olympiques, le Palais des congrès de Montréal et Centre des congrès de Québec, ont également cessé leurs activités accueillant le public."
QnA,Tourisme - loisir - culture - sport,"Est-ce que les rassemblements qu'ils soit intérieurs ou extérieurs sont interdits?",plop,"Afin de protéger la population, le gouvernement du Québec interdit les rassemblements intérieurs et extérieurs. Quelques exceptions, présentées dans la page [Rassemblements et événements]( ), sont toutefois prévues. Si une personne doit se rendre dans un rassemblement qui fait partie des exceptions autorisées par le gouvernement du Québec, elle est invitée à limiter au maximum la durée de ses présences et à garder, dans la mesure du possible, une distance de deux mètres avec les autres personnes présentes."
QnA,Tourisme - loisir - culture - sport,Les Assises du tourisme 2020 seront elles aussi reportées ?,plop,"En raison de la situation liée à la pandémie de la COVID-19 et des défis logistiques importants qui en découlent, les Assises du tourisme 2020 sont reportées à une date ultérieure."
QnA,Tourisme - loisir - culture - sport,"Des touristes viennent de quitter, je fais quoi avec mon airbnb?",plop,Consultez la politique de la plateforme d’hébergement collaboratif en question. La plupart ont convenu de mesures de soutien en lien avec la crise sanitaire actuelle ou prévoient des clauses pour force majeure.
QnA,Tourisme - loisir - culture - sport,"Si je suis un campeur saisonnier, est-ce que je peux me rendre sur les terrains de camping?",plop,"Les campeurs saisonniers, qu’ils soient propriétaires ou non du lot, ne peuvent actuellement se rendre sur les terrains de camping. Ceux-ci doivent demeurer fermés, à l’exception des terrains accueillant des _snowbirds_ qui n’ont pas d’autre option de logement en sol québécois. Toutefois, ces terrains ne sont pas accessibles aux autres campeurs. Rappelons que, depuis le 28 mars 2020, il a été demandé à toute personne d’éviter de se déplacer d’une région à l’autre ou d’une ville à l’autre, sauf en cas de nécessité, soit pour des raisons médicales ou pour le travail, si le télétravail n’est pas possible."
QnA,Tourisme - loisir - culture - sport,"Est-ce qu'on peut utliser des fax pour envoyer des papiers au Ministère du Tourisme?",plop,"Bien que le courrier continue d’être traité, il est possible que la situation actuelle occasionne certains délais. Il est donc recommandé de transmettre tous les documents par courriel pour accélérer le traitement des dossiers. Dans le cas où votre demande requiert une signature officielle, vous pouvez numériser votre document et l’acheminer à un [conseiller]( ) par courriel, puis poster l’original, qui sera joint à votre dossier."
QnA,Tourisme - loisir - culture - sport,"J'ai loué un chalet pour me réfugier en paix pendant la crise. Vais-je pouvoir y aller ?",plop,"Qu’il se déroule dans un chalet, un centre de villégiature ou tout autre établissement d’hébergement touristique visé par cette mesure, le séjour n’a pas à être écourté s’il a débuté avant le 29 mars 2020, mais il ne peut pas être prolongé. Il faut respecter les directives de santé publique : *   Éviter toute fréquentation des commerces et autres lieux publics à destination. *   Ne pas tenir de rassemblement intérieur ou extérieur."
QnA,Tourisme - loisir - culture - sport,"Est-ce qu'il y a encore moyen d'envoyer des documents à un employé du ministère du Tourisme? Comment on fait ?",plop,"Bien que le courrier continue d’être traité, il est possible que la situation actuelle occasionne certains délais. Il est donc recommandé de transmettre tous les documents par courriel pour accélérer le traitement des dossiers. Dans le cas où votre demande requiert une signature officielle, vous pouvez numériser votre document et l’acheminer à un [conseiller]( ) par courriel, puis poster l’original, qui sera joint à votre dossier."
QnA,Tourisme - loisir - culture - sport,"Est-ce que les propriétaires d’établissement d’hébergement touristique (résidences de tourisme, gîtes, auberges de jeunesse, etc.) auront droit à une aide financière pour compenser les pertes de location?",plop,"La [Corporation de l’industrie touristique du Québec (CITQ) ]( ) a suspendu les frais annuels d’attestation, et ce, jusqu’à une date indéterminée. De plus, depuis l’annonce des mesures gouvernementales, aucun avis de paiement des frais annuels n’est transmis aux exploitants. Conséquemment, aucune pénalité ne sera imposée et aucune attestation ne sera annulée. Pour les exploitants qui auraient déjà payé les frais annuels pour 2020, la durée de validité de l’attestation sera prolongée afin de tenir compte de la période de fermeture demandée par le gouvernement. Par ailleurs, les exploitants d’établissement d’hébergement touristique peuvent vérifier s’ils sont admissibles à l’une ou l’autre des différentes mesures mises en place par le gouvernement du Québec pour soutenir les entreprises, en visitant la page [Québec.ca/coronavirus]( ) . Enfin, les exploitants touchés par la crise actuelle peuvent vérifier auprès de leur établissement financier et de leur municipalité s’ils sont admissibles à certains assouplissements."
QnA,Tourisme - loisir - culture - sport,Les piscines munipales vont-elles être ouvertes cet été?,plop,"*   dans un lieu public visant à obtenir un service ou un bien (commerces, services gouvernementaux, etc.) qui n’est pas visé par une suspension du gouvernement du Québec, à condition que les clients maintiennent, dans la mesure du possible, une distance minimale de deux mètres entre eux; *   dans un moyen de transport, à condition que les usagers maintiennent, dans la mesure du possible, une distance minimale de deux mètres entre eux; *   réunissant des occupants dans une résidence privée ou dans ce qui en tient lieu, et toute autre personne leur offrant un service ou dont le soutien est requis. Les personnes offrant un service ou apportant un soutien doivent maintenir, dans la mesure du possible, une distance minimale de deux mètres avec les occupants."
QnA,Tourisme - loisir - culture - sport,Est-ce que la fermeture des établissements d’hébergement touristique par le gouvernement québécois est justifiée ?,plop,"À la différence d’autres types d’activités économiques d’entreprises ou de services, la fréquentation d’établissements d’hébergement touristique implique davantage de déplacements d’une ville à l’autre et d’une région à l’autre."
QnA,Tourisme - loisir - culture - sport,"Je fais quoi avec le chalet que j'ai loué pour le début avril ?",plop,"Qu’il se déroule dans un chalet, un centre de villégiature ou tout autre établissement d’hébergement touristique visé par cette mesure, le séjour n’a pas à être écourté s’il a débuté avant le 29 mars 2020, mais il ne peut pas être prolongé. Il faut respecter les directives de santé publique : *   Éviter toute fréquentation des commerces et autres lieux publics à destination. *   Ne pas tenir de rassemblement intérieur ou extérieur."
QnA,Tourisme - loisir - culture - sport,"Je suis un snowbird qui revient de voyage en motorisé, qu'est-ce que je fais?",plop,"S’ils voyagent avec leur roulotte ou leur motorisé, les _snowbirds_ qui n’ont pas d’autre option de logement au Québec peuvent s’installer sur l’un des terrains désignés pour les recevoir. La liste de ces campings est disponible sur le site de Camping Québec. Ceux-ci peuvent accueillir des visiteurs en se conformant à l’ensemble des directives suivantes : *   Seuls les _snowbirds_ qui voyagent avec leur roulotte ou leur motorisé et qui n’ont pas d’autre option de logement au Québec peuvent camper sur les terrains concernés; *   Les campings doivent fermer tous les accès aux espaces communs; *   Les services d’eau, d’électricité et d’égout doivent être fournis directement sur les sites, afin de permettre aux campeurs de respecter l’isolement obligatoire de 14 jours suivant leur retour ainsi que la distanciation physique à la suite de leur isolement complet;"
QnA,Tourisme - loisir - culture - sport,Quelles répercussions les directives de santé et de sécurité en lien avec la COVID-19 ont-elles sur le fonctionnement et les services du ministère du Tourisme?,plop,"Les activités du ministère du Tourisme se poursuivent afin de bien soutenir l’industrie. Conformément aux directives de santé publique, la majorité du personnel assure sa prestation de services en télétravail. En vue de faciliter le traitement des dossiers, les entreprises touristiques sont invitées à transmettre tous les documents par courrier électronique, y compris les conventions d’aide financière en cours de signature. En raison de la crise sanitaire actuelle, le centre d’appels et les centres Infotouriste sont fermés jusqu’à nouvel ordre. Les sociétés d’État sous la responsabilité du Ministère, soit la Régie des installations olympiques, le Palais des congrès de Montréal et Centre des congrès de Québec, ont également cessé leurs activités accueillant le public."
QnA,Tourisme - loisir - culture - sport,Est-ce que les Bed & Breakfast sont fermés?,plop,"Le gouvernement du Québec a annoncé la fermeture des établissements d'hébergement touristique jusqu'à nouvel ordre. Cependant, deux types d'hébergement font exception, soit certains terrains de camping faisant l'accueil de voyageurs n'ayant pas d'autre option de logement et disposant d’installations sanitaires suffisantes, ainsi que les hôtels. Les autres types d'hébergement touristique, tel que les chalets, les résidences secondaires en location, les « Bed & Breakfast » et les auberges doivent être fermés."
QnA,Tourisme - loisir - culture - sport,"Je suis propritétaire d'un gîte, est-ce que je peux héberger des voyageurs qui doivent se mettre en quarantaine?",plop,Le gouvernement du Québec a nommé deux types d’établissements d’hébergement pouvant offrir des services essentiels aux clientèles dans le besoin à la suite des directives de santé publique. Il s’agit des établissements hôteliers (hôtels et motels) ainsi que de certains terrains de camping faisant l’accueil de _snowbirds_ qui voyagent avec leur roulotte ou leur motorisé et qui n’ont pas d’autre option de logement. La liste de ces campings est disponible sur le site de Camping Québec. Les autres établissements doivent demeurer fermés.
QnA,Tourisme - loisir - culture - sport,Est-ce que les exploitants touchés par la crise actuelle peuvent vérifier auprès de leur établissement financier s’ils sont admissibles à certains assouplissements?,plop,"La [Corporation de l’industrie touristique du Québec (CITQ) ]( ) a suspendu les frais annuels d’attestation, et ce, jusqu’à une date indéterminée. De plus, depuis l’annonce des mesures gouvernementales, aucun avis de paiement des frais annuels n’est transmis aux exploitants. Conséquemment, aucune pénalité ne sera imposée et aucune attestation ne sera annulée. Pour les exploitants qui auraient déjà payé les frais annuels pour 2020, la durée de validité de l’attestation sera prolongée afin de tenir compte de la période de fermeture demandée par le gouvernement. Par ailleurs, les exploitants d’établissement d’hébergement touristique peuvent vérifier s’ils sont admissibles à l’une ou l’autre des différentes mesures mises en place par le gouvernement du Québec pour soutenir les entreprises, en visitant la page [Québec.ca/coronavirus]( ) . Enfin, les exploitants touchés par la crise actuelle peuvent vérifier auprès de leur établissement financier et de leur municipalité s’ils sont admissibles à certains assouplissements."
QnA,Employeurs - travailleurs - normes du travail,Puis-je avoir recours aux services de personnes ou de proches pour divers types de travaux à domicile?,plop,"Quelqu’un peut recevoir chez lui une personne ou un proche qui offre un service essentiel ou prioritaire ou dont le soutien est requis. Toutefois, il convient de faire preuve de prudence et de s’assurer que le service requis ne peut attendre. Par exemple, faire venir un plombier pour une réparation urgente est permis. En contrepartie, il est déconseillé, dans le contexte actuel, de faire appel à un plombier pour des tâches qui peuvent attendre, comme le remplacement d’un évier fonctionnel. Cette recommandation s’applique également aux personnes ou aux proches qui viendraient, par exemple, faire du ménage à domicile. Si le service ou le soutien requis ne peut attendre, les personnes doivent maintenir, dans la mesure du possible, une distance minimale de deux mètres et appliquer les [consignes sanitaires]( ) de base."
QnA,Employeurs - travailleurs - normes du travail,"Si j'ai plus de 70 ans, est-ce que je devrais travailler ?",plop,"Une évaluation au cas par cas doit être faite. Si le travailleur ne fournit pas de services essentiels, il devrait rester à la maison et, si possible, faire du télétravail. Si ce n’est pas possible et que ce travailleur offre un service essentiel, on pourra le maintenir en poste s’il est en bonne santé tout en mettant en place des mesures de protection pour lui-même. Le travailleur devra appliquer les mesures de prévention."
QnA,Employeurs - travailleurs - normes du travail,Je suis disponible pour travailler dans une entreprise agricole ou de transformation alimentaire. Où puis-je m’adresser pour offrir mes services?,plop,"En ce qui concerne les entreprises agricoles, vous êtes invités à consulter le site [Centres d'emploi agricole]( ) de l'Union des producteurs agricoles (UPA), consacré à l’emploi dans ce secteur d’activité. Le portail québécois [À table! Emplois]( )  a été lancé pour faciliter le recrutement dans les entreprises de transformation alimentaire. Ce portail est gratuit. Il permet, pendant la pandémie de la COVID-19, de jumeler les employeurs à la recherche de personnel temporaire et les travailleurs qui veulent donner un coup de main. Ce recrutement vise à assurer l'approvisionnement continu de produits dans les épiceries et sur les tables des Québécois. Vous pouvez vous inscrire dans ce portail pour occuper des postes temporaires. Le Programme incitatif pour la rétention des travailleurs essentiels (PIRTE) est mis en œuvre par le gouvernement du Québec et permet de bonifier la Subvention salariale d'urgence du gouvernement fédéral."
QnA,Employeurs - travailleurs - normes du travail,Mon employeur fait rien pour me protéger ya tu le droit,plop,"Oui, l'employeur doit prendre toutes les mesures nécessaires pour protéger la santé et assurer la sécurité et l’intégrité physique du travailleur comme le prévoit l'article 51 de la _Loi sur la santé et la sécurité du travail_ (LSST). Pour ce faire, l’employeur doit mettre en œuvre des mesures d’identification, de contrôle et d’élimination de ce risque biologique. À titre d’exemple, l’employeur doit appliquer les mesures d’hygiène nécessaires pour limiter la propagation du virus. Il peut aussi adopter une pratique de travail favorisant la distance physique pour minimiser les risques. Cette pratique peut inclure des moyens tels : *   éviter les réunions face à face non essentielles; *   utiliser des outils technologiques pour les communications avec et entre les travailleurs; *   favoriser le télétravail."
QnA,Employeurs - travailleurs - normes du travail,Mon employeur peut-il me congédier si je ne souhaite pas aller travailler dans un endroit à risque?,plop,"Dans le cas d’un refus de travail, un inspecteur de la CNESST déterminera dans les plus brefs délais s’il existe un danger ou non sur les lieux de travail en question."
QnA,Employeurs - travailleurs - normes du travail,Si je suis fonctionnaire je peux tu faire du télétravail?,plop,"Si le télétravail est possible, vous pourrez y recourir pour la durée prévue de l’isolement, soit 14 jours consécutifs. S’il est impossible d’effectuer vos tâches de cette façon, votre gestionnaire évaluera la pertinence de vous confier, en télétravail, d’autres tâches pour lesquelles vous avez les compétences. Discutez-en avec votre gestionnaire. Si le maintien de vos tâches en mode télétravail est impossible, votre salaire sera tout de même maintenu. *   L’accès aux locaux est interdit. *   Si le maintien de toute prestation de service en mode télétravail est impossible, le traitement sera maintenu."
QnA,Employeurs - travailleurs - normes du travail,Je travaille dans le secteur privé et je dois me placer en isolement. Est-ce que mon employeur peut me congédier?,plop,Le gouvernement du Québec invite les employeurs à faire preuve de compréhension et de souplesse envers un employé qui revient de voyage ou qui présente des symptômes.
QnA,Employeurs - travailleurs - normes du travail,Est-ce que mon employeur va prendre des mesures pour nous protéger,plop,"Oui, l'employeur doit prendre toutes les mesures nécessaires pour protéger la santé et assurer la sécurité et l’intégrité physique du travailleur comme le prévoit l'article 51 de la _Loi sur la santé et la sécurité du travail_ (LSST). Pour ce faire, l’employeur doit mettre en œuvre des mesures d’identification, de contrôle et d’élimination de ce risque biologique. À titre d’exemple, l’employeur doit appliquer les mesures d’hygiène nécessaires pour limiter la propagation du virus. Il peut aussi adopter une pratique de travail favorisant la distance physique pour minimiser les risques. Cette pratique peut inclure des moyens tels : *   éviter les réunions face à face non essentielles; *   utiliser des outils technologiques pour les communications avec et entre les travailleurs; *   favoriser le télétravail."
QnA,Employeurs - travailleurs - normes du travail,"21. En isolement ou en télétravail, pouvez-vous utiliser vos équipements technologiques personnels ?",plop,"Pour toute question, le gestionnaire doit se référer au dirigeant de l’information de son organisation."
QnA,Employeurs - travailleurs - normes du travail,Directives pour le personnel de la fonction publique.,plop,"*   Par ailleurs, des services de garde seront disponibles pour le personnel faisant partie des services essentiels (réseau de la santé, policiers, pompiers, ambulanciers, agents des services correctionnels, constables spéciaux). *   Chaque ministère et organisme de la fonction publique est responsable d’avoir un plan de maintien des services essentiels en cas de pandémie. *   En cas de sinistre majeur réel ou imminent, le SCT est responsable de la mission de redéploiement des ressources pour le maintien des services essentiels à la population. Si vous travaillez dans un établissement de soins de santé ou scolaire, consultez les directives émises par votre établissement. Consultez la section [Consignes sanitaires ]( ) pour tous pour diminuer les risques de propagation du virus. Vous devez rester chez vous et vous n’avez plus accès aux locaux."
QnA,Employeurs - travailleurs - normes du travail,Quels sont les travailleurs ayant froit aux services essentiels ?,plop,Consultez la [liste des services et activités prioritaires]( ).
