Feedback,0,coiffure,Consultez la [liste des services et activités prioritaires](https://www.quebec.ca/sante/problemes-de-sante/a-z/coronavirus-2019/fermeture-endroits-publics-commerces-services-covi,"À l’heure actuelle, les femmes enceintes peuvent être accompagnées par une personne qui leur est chère pour leur accouchement dans les hôpitaux du Québec. Certaines mesures particulières peuvent toutefois être prises par les centres hospitaliers, comme c’est le cas présentement à l’Hôpital général juif de Montréal. Pour obtenir plus d’information à cet effet, les femmes enceintes peuvent contacter leur centre hospitalier."
Feedback,0,"comment peux t'on covoiturer ?","Les services de transport en commun demeurent opérationnels et représentent un service essentiel pour permettre, notamment, au personnel du réseau de la santé et des services sociaux de se déplacer. Les sociétés de transport du Québec ont accentué la fréquence de l’entretien de leurs véhicules et installations. Les usagers sont tout de même invités à appliquer les consignes sanitaires habituelles et à conserver, dans la mesure du possible, une distance de deux mètres avec les autres personnes pr","La fièvre est un mécanisme de défense qui aide à combattre l’infection. Si vous souhaitez abaisser votre fièvre pour être plus confortable, il est recommandé d’utiliser de l’acétaminophène, à moins d’un avis contraire d’un professionnel de la santé ou d’une allergie à ce médicament. *   Chez l’enfant : 38 °C (100,4 °F) et plus (T° rectale); *   Chez l’adulte : 38 °C (100,4 °F) et plus (T° buccale); *   Chez la personne âgée : 37,8 °C (98,6 °F) et plus (T° buccale); *   1,1 °C de plus que la valeur habituelle d’une personne."
Feedback,0,une dame  de ménage peut elle venir à la maison faire notre ménage ,"Il est possible d’aller livrer de l’épicerie à une personne âgée ou une personne ayant un système immunitaire affaibli uniquement si vous ne présentez aucun symptôme et ne revenez pas de voyage depuis moins de 14 jours. En tout temps, il importe de conserver une distance entre les personnes, d’éviter les contacts directs et de respecter les règles d’hygiène habituelles lorsque vous toussez ou éte","ll est possible d’aller livrer de l’épicerie à une personne âgée ou une personne ayant un système immunitaire affaibli uniquement si vous ne présentez aucun symptôme et ne revenez pas de voyage depuis moins de 14 jours. En tout temps, il importe de conserver une distance entre les personnes, d’éviter les contacts directs et de respecter les règles d’hygiène habituelles lorsque vous toussez ou éternuez."
Feedback,0,est-ce que les balades en moto son permis en duo?,"Les services de transport en commun demeurent opérationnels et représentent un service essentiel pour permettre, notamment, au personnel du réseau de la santé et des services sociaux de se déplacer. Les sociétés de transport du Québec ont accentué la fréquence de l’entretien de leurs véhicules et installations. Les usagers sont tout de même invités à appliquer les consignes sanitaires habituelles et à conserver, dans la mesure du possible, une distance de deux mètres avec les autres personnes pr","Oui, en solitaire. Cependant, les mêmes consignes relatives aux déplacements s’appliquent, c’est-à-dire que ceux-ci devraient se limiter à des raisons médicales et pour le travail, dans un contexte où le télétravail n'est pas possible."
Feedback,0,"c'est un logement que je veux",Consultez la politique de la plateforme d’hébergement collaboratif en question. La plupart ont convenu de mesures de soutien en lien avec la crise sanitaire actuelle ou prévoient des clauses pour force ma,"Dans le contexte actuel, les autorités de santé publique recommandent la suspension des visites aux logements pour le moment. Si, malgré cela, il y a une visite, il y a des mesures de précaution à prendre. En premier lieu, il est important de reporter toutes les visites des logements dont les locataires sont atteints de la COVID‑19 ou s’ils sont en isolement en raison de symptômes grippaux ou d’un retour de voyage. *   partager toute information pertinente sur les logements afin de s’assurer de l’intérêt des visiteurs; *   vérifier que les visiteurs n’ont pas voyagé dans les 14 derniers jours et qu’ils ne ressentent aucun symptôme grippal; *   demander aux visiteurs qu’ils se lavent les mains avant d’entrer dans les logements; *   limiter le nombre de personnes, préférablement à un seul visiteur à la fois;"
Feedback,0,est-ce que les grands parents peuvent garder les enfants? merci,"Il est possible d’aller livrer de l’épicerie à une personne âgée ou une personne ayant un système immunitaire affaibli uniquement si vous ne présentez aucun symptôme et ne revenez pas de voyage depuis moins de 14 jours. En tout temps, il importe de conserver une distance entre les personnes, d’éviter les contacts directs et de respecter les règles d’hygiène habituelles lorsque vous toussez ou éte","Si vous avez 70 ans ou plus, vous ne devriez pas proposer de garder vos petits-enfants, car cela augmente vos risques d’être exposé au virus. D’ailleurs, vous devriez éviter les contacts avec toutes les personnes ne vivant pas sous votre toit. C’est pourquoi on vous demande aussi de sortir le moins possible, sauf en cas de nécessité."
Feedback,0,"est-ce que je peux louer motel ma maison n'est pas prête pour le 29 mai","*   Les hôtels et les motels. *   Les campings désignés pour l’accueil des _snowbirds_, lesquels sont répertoriés sur le site de Camping Québec. Tous les terrains de camping doivent demeurer fermés, à l’exception des terrains qui accueillent les _snowbirds_ n’ayant pas d’autre option de logement en sol québécois. Pour accueillir ces derniers, le camping doit offrir les trois services (eau, électricité, égout) afin de s’assurer que le campeur peut demeurer en confinement obligatoire pendant 14 jo","Qu’il se déroule dans un chalet, un centre de villégiature ou tout autre établissement d’hébergement touristique visé par cette mesure, le séjour n’a pas à être écourté s’il a débuté avant le 29 mars 2020, mais il ne peut pas être prolongé. Il faut respecter les directives de santé publique : *   Éviter toute fréquentation des commerces et autres lieux publics à destination. *   Ne pas tenir de rassemblement intérieur ou extérieur."
Feedback,0,je suis un guide de pêche avec des bateaux de 20 pieds aprouver par transport canada,Consultez la politique de la plateforme d’hébergement collaboratif en question. La plupart ont convenu de mesures de soutien en lien avec la crise sanitaire actuelle ou prévoient des clauses pour force ma,"Des Québécois ayant été sur certaines croisières ont été en contact avec des personnes potentiellement contagieuses. En raison du risque de transmission dans le contexte d’une croisière, il est demandé à ces croisiéristes d’être obligatoirement en isolement pour une période de 14 jours après leur date d’arrivée au Canada et de surveiller leurs symptômes (fièvre, toux, difficultés respiratoires ou perte soudaine de l’odorat sans congestion nasale, avec ou sans perte de goût). Si vous éprouvez ces [symptômes]( ), communiquez avec la ligne [1 877 644‑4545](tel:+1-877-644-4545). Cet isolement vise autant les voyageurs malades ou qui ressentent des symptômes que ceux qui n’en ont pas et qui sont en parfaite santé. En aucun temps, ces personnes ne doivent sortir à l’extérieur, et ce, même pour prendre une marche."
Feedback,0,est-ce que je peux faire de la moto?,"Les services de transport en commun demeurent opérationnels et représentent un service essentiel pour permettre, notamment, au personnel du réseau de la santé et des services sociaux de se déplacer. Les sociétés de transport du Québec ont accentué la fréquence de l’entretien de leurs véhicules et installations. Les usagers sont tout de même invités à appliquer les consignes sanitaires habituelles et à conserver, dans la mesure du possible, une distance de deux mètres avec les autres personnes pr","Oui, en solitaire. Cependant, les mêmes consignes relatives aux déplacements s’appliquent, c’est-à-dire que ceux-ci devraient se limiter à des raisons médicales et pour le travail, dans un contexte où le télétravail n'est pas possible."
Feedback,0,"j'ai un chalet personnel puis-je y aller",Consultez la politique de la plateforme d’hébergement collaboratif en question. La plupart ont convenu de mesures de soutien en lien avec la crise sanitaire actuelle ou prévoient des clauses pour force ma,"Oui, sauf si vous avez reçu la consigne de vous isoler pendant 14 jours. Dans ce cas, vous devez rester confiné à la maison, ce qui inclut aussi que et vous ne pouvez pas sortir marcher jusqu’à la fin de votre isolement. Si vous n’avez pas reçu la consigne de vous isoler : *   Pour les personnes qui vivent dans un CHSLD ou une résidence privée pour aînés ou celles qui sont confiées en ressources intermédiaires et en ressources de type familial (RI‑RTF), les sorties à l’extérieur sont tolérées, mais elles doivent être faites sous supervision. *   Toutes les autres personnes peuvent sortir à l’extérieur pour prendre l’air et marcher. L’important est de garder une distance minimale de 2 mètres (environ 6 pieds) entre vous et les autres personnes qui ne vivent pas sous votre toit."
Feedback,0,"Information sur l'aide temporaire aux travailleurs (PATT)","Le gouvernement fédéral a annoncé le 25 mars le programme Prestation canadienne d’urgence (PCU), qui représente une aide financière de 2 000 $ par mois pour les travailleurs qui sont victimes de la pandémie de COVID-19. Tous les Canadiens qui ne peuvent plus travailler à cause de la COVID-19, qu’ils soient admissibles ou non à l’assurance‑emploi, y ont droit, notamment : *   Ceux qui ont perdu des revenus à cause de la COVID-19 (dont ceux qui ont toujours un emploi, mais qui ne reçoivent aucun r","Le Programme d’aide temporaire aux travailleurs (PATT) a été lancé le 16 mars 2020 et était destiné à offrir une aide financière pour répondre aux besoins des travailleurs qui, en raison d’un isolement pour contrer la propagation du virus COVID-19, ne pouvaient gagner en totalité leur revenu de travail et qui n’étaient pas admissibles à un autre programme d’aide financière. Le 6 avril 2020, le gouvernement canadien a mis en œuvre la [Prestation canadienne d’urgence (PCU)]( ) , qui couvre les mêmes besoins que ceux visés par le PATT. Étant donné que la Prestation canadienne d’urgence (PCU) peut être obtenue par une grande partie des travailleurs admissibles au Programme d’aide temporaire aux travailleurs (PATT), **ce programme a été abandonné le 10 avril 2020**, pour ne pas doubler les programmes d’aide financière."
Feedback,0,où puis-je me tester?,"*   [Soutenir le réseau de la santé](https://jecontribuecovid19.gouv.qc.ca/)  *   [Participer à une étude clinique pour le traitement des personnes testées positives à la COVID-19](https://www.colcorona.org/)  *   [Soutenir le réseau des services de garde éducatifs à l'enfance](https://www.quebec.ca/famille-et-soutien-aux-personnes/servicesgardeeducatifsenfance-covid19/#c58397) *   [Donnez du sang](https://www.hema-quebec.qc.ca/index.fr.html)  *   [Devenir bénévole](https://www.jebenevol","La situation de la pandémie du coronavirus (COVID‑19) évolue très rapidement. Alors qu’en janvier et en février la situation de la transmission de la COVID‑19 était largement liée à des importations dues aux voyageurs, la transmission communautaire est maintenant celle qui génère le plus de cas. Ainsi, la priorisation des détections doit être revue. Elle est désormais recentrée sur les personnes les plus à risque d’être hospitalisées ou de développer des complications à la suite de l’infection et celles qui occupent des fonctions stratégiques dans la lutte contre l’infection au Québec. Cette priorisation des tests de détection contribue à maintenir les services de santé, les services de premiers répondants et les services essentiels en détectant les personnes symptomatiques qui pourraient être impliquées dans des éclosions dans leur milieu de travail ainsi qu’auprès de personnes à risque."
Feedback,0,"est-ce que deux personnes n'habitant pas à la meme adresse peuvent circuler dans la meme voiture","Les services de transport en commun demeurent opérationnels et représentent un service essentiel pour permettre, notamment, au personnel du réseau de la santé et des services sociaux de se déplacer. Les sociétés de transport du Québec ont accentué la fréquence de l’entretien de leurs véhicules et installations. Les usagers sont tout de même invités à appliquer les consignes sanitaires habituelles et à conserver, dans la mesure du possible, une distance de deux mètres avec les autres personnes pr","Il est interdit de tenir tout rassemblement intérieur ou extérieur avec des personnes qui ne vivent pas dans la même demeure, ceci inclut des membres de famille immédiate qui habiteraient dans un autre logement. Pour ce qui est des marches, il faut respecter une distance minimale de deux mètres entre l’ensemble des personnes, sauf s’il s’agit de personnes qui habitent la même résidence privée."
Feedback,0,peut on recevoir des amis dans la cour,"Des médicaments en vente libre peuvent être utilisés pour soulager les symptômes de la maladie à coronavirus (COVID‑19). Avant d’en faire usage, lisez attentivement les étiquettes et respectez les doses recommandées. **Il est fortement recommandé de demander conseil à votre pharmacien** avant d’utiliser des médicaments en vente libre en présence de symptômes. Évitez de prendre en même temps des produits qui contiennent les mêmes ingrédients comme du Tylenol MD et du Tylenol sinus","Comme le risque de transmission du virus dans la communauté est présent, il faut éviter les contacts rapprochés entre les enfants qui n’habitent pas sous le même toit, et ce, même lorsque ceux-ci jouent à l’extérieur. Même si les risques de complications sont plus faibles chez les enfants infectés par la COVID‑19, ceux-ci peuvent transmettre la maladie à leur entourage, notamment à des personnes plus à risque. Votre enfant ne devrait pas jouer avec un ou des enfants qui ne vivent pas sous votre toit, mais peut maintenir des liens virtuels avec eux."
Feedback,0,Consignes pour les personnes vulnérables et leurs proches,"Si vous ou votre enfant avez des irritations de la peau ou une réaction allergique ou inflammatoire de la peau lorsque vous vous lavez les mains avec du gel hydroalcoolique, veuillez cesser l’utilisation de ce produit. Utilisez plutôt de l’eau et du savon pour vous laver les mains. Le lavage fréquent des mains et le lavage des mains avec du gel hydroalcoolique peuvent causer une sécheresse de la peau. Afin de prévenir cette sécheresse, il est recommandé d’appliquer de la crème hydratante sur les","Si vous vivez avec une ou des personnes qui n’ont pas voyagé, vous devez respecter les [consignes à suivre pour la personne de retour d'un pays étranger (PDF 377 Ko)]( ). Vous pouvez contacter le service Info-Social 811 (consultation téléphonique psychosociale 24/7) si vous vivez du [stress, de l’anxiété ou de la déprime liés à la COVID-19]( ). Des professionnels en intervention psychosociale vous offriront du soutien et vous partageront de l’information et des conseils selon vos besoins."
Feedback,0,est-ce que je peux me rendre dans les laurentides?,"Les services de transport en commun demeurent opérationnels et représentent un service essentiel pour permettre, notamment, au personnel du réseau de la santé et des services sociaux de se déplacer. Les sociétés de transport du Québec ont accentué la fréquence de l’entretien de leurs véhicules et installations. Les usagers sont tout de même invités à appliquer les consignes sanitaires habituelles et à conserver, dans la mesure du possible, une distance de deux mètres avec les autres personnes pr","Oui, sauf si vous avez reçu la consigne de vous isoler pendant 14 jours. Dans ce cas, vous devez rester confiné à la maison, ce qui inclut aussi que et vous ne pouvez pas sortir marcher jusqu’à la fin de votre isolement. Si vous n’avez pas reçu la consigne de vous isoler : *   Pour les personnes qui vivent dans un CHSLD ou une résidence privée pour aînés ou celles qui sont confiées en ressources intermédiaires et en ressources de type familial (RI‑RTF), les sorties à l’extérieur sont tolérées, mais elles doivent être faites sous supervision. *   Toutes les autres personnes peuvent sortir à l’extérieur pour prendre l’air et marcher. L’important est de garder une distance minimale de 2 mètres (environ 6 pieds) entre vous et les autres personnes qui ne vivent pas sous votre toit."
Feedback,0,Protéger nos personnes âgées,80 % des personnes infectées guérissent sans traitement particulier. Il existe des groupes de personnes à risque de décéder à la suite des complications respiratoires graves si elles sont infectées par le coronavirus. Il pourrait s’agir d’une pneumonie ou d’un syndrome respiratoire aigu. **Les personnes infectées au coronavirus (COVID-19) à risque de décès sont :** *   les personnes âgées de 70 ans et plus; *   les personnes avec les conditions suivantes :     *   maladies chroniques cardiaques;,"Les personnes âgées sont plus à risques de se déshydrater notamment en raison du fait que la sensation de soif s’émousse en vieillissant. Elles ne pensent donc pas toujours à boire parce qu’elles ne ressentent pas la soif. *   Faire penser **souvent** à boire aux personnes âgées; *   Encourager la prise de liquides supplémentaire avec les repas et les médicaments; *   Éviter la prise d’alcool et de caféine. En présence d’infection, les personnes âgées ont besoin d’augmenter leur prise de protéines. On trouve les protéines dans la viande, les poissons, les légumineuses, les œufs, les produits laitiers et les noix. **Il est important de prendre des collations contenant des protéines entre les repas et avant le coucher. ** Une immobilité complète au lit ou au fauteuil a des conséquences importantes sur la perte d’autonomie et l’apparition de complications."
Feedback,0,"quand peut-on recommencer à faire de l'entretien ménager ??   femme de ménage ??? ","Toute personne ayant fréquenté tout lieu public doit surveiller ses symptômes et respecter les consignes sanitaires suivantes : *   [Lavez-vous les mains](https://www.quebec.ca/sante/conseils-et-prevention/prevention-des-accidents-des-lesions-et-des-maladies/lavage-des-mains/) souvent à l'eau tiède courante et au savon pendant au moins 20 secondes. *   Utilisez un désinfectant à base d'alcool si vous n'avez pas accès à de l'eau et à du savon. *   Observez les règles d'hygiène lorsque vous tousse","Quelqu’un peut recevoir chez lui une personne ou un proche qui offre un service essentiel ou prioritaire ou dont le soutien est requis. Toutefois, il convient de faire preuve de prudence et de s’assurer que le service requis ne peut attendre. Par exemple, faire venir un plombier pour une réparation urgente est permis. En contrepartie, il est déconseillé, dans le contexte actuel, de faire appel à un plombier pour des tâches qui peuvent attendre, comme le remplacement d’un évier fonctionnel. Cette recommandation s’applique également aux personnes ou aux proches qui viendraient, par exemple, faire du ménage à domicile. Si le service ou le soutien requis ne peut attendre, les personnes doivent maintenir, dans la mesure du possible, une distance minimale de deux mètres et appliquer les [consignes sanitaires]( ) de base."
Feedback,0,"j'ai 82 ans  je peux prendre ma voiture pour aller  faire tour  sans debarquer de ma voiture","Les services de transport en commun demeurent opérationnels et représentent un service essentiel pour permettre, notamment, au personnel du réseau de la santé et des services sociaux de se déplacer. Les sociétés de transport du Québec ont accentué la fréquence de l’entretien de leurs véhicules et installations. Les usagers sont tout de même invités à appliquer les consignes sanitaires habituelles et à conserver, dans la mesure du possible, une distance de deux mètres avec les autres personnes pr","Si vous avez 70 ans ou plus, vous ne devriez pas proposer de garder vos petits-enfants, car cela augmente vos risques d’être exposé au virus. D’ailleurs, vous devriez éviter les contacts avec toutes les personnes ne vivant pas sous votre toit. C’est pourquoi on vous demande aussi de sortir le moins possible, sauf en cas de nécessité."
Feedback,0,puis-je coucher à mon chalet,Consultez la politique de la plateforme d’hébergement collaboratif en question. La plupart ont convenu de mesures de soutien en lien avec la crise sanitaire actuelle ou prévoient des clauses pour force ma,"Oui, sauf si vous avez reçu la consigne de vous isoler pendant 14 jours. Dans ce cas, vous devez rester confiné à la maison, ce qui inclut aussi que et vous ne pouvez pas sortir marcher jusqu’à la fin de votre isolement. Si vous n’avez pas reçu la consigne de vous isoler : *   Pour les personnes qui vivent dans un CHSLD ou une résidence privée pour aînés ou celles qui sont confiées en ressources intermédiaires et en ressources de type familial (RI‑RTF), les sorties à l’extérieur sont tolérées, mais elles doivent être faites sous supervision. *   Toutes les autres personnes peuvent sortir à l’extérieur pour prendre l’air et marcher. L’important est de garder une distance minimale de 2 mètres (environ 6 pieds) entre vous et les autres personnes qui ne vivent pas sous votre toit."
Feedback,0,covoiturage permis,"Les services de transport en commun demeurent opérationnels et représentent un service essentiel pour permettre, notamment, au personnel du réseau de la santé et des services sociaux de se déplacer. Les sociétés de transport du Québec ont accentué la fréquence de l’entretien de leurs véhicules et installations. Les usagers sont tout de même invités à appliquer les consignes sanitaires habituelles et à conserver, dans la mesure du possible, une distance de deux mètres avec les autres personnes pr","*   les frais d’exploitation; *   les frais d’administration; *   les frais de nettoyage et de désinfection des avions; *   les frais liés aux mesures mises en place pour dépister les passagers atteints de la COVID‑19; à l’exception, notamment, des dépenses pour lesquelles un remboursement était prévu par une autre forme d’aide financière publique au moment du dépôt de la demande."
Feedback,0,est-ce que les élèves doivent faire les devoirs?,"Si vous ou votre enfant avez des irritations de la peau ou une réaction allergique ou inflammatoire de la peau lorsque vous vous lavez les mains avec du gel hydroalcoolique, veuillez cesser l’utilisation de ce produit. Utilisez plutôt de l’eau et du savon pour vous laver les mains. Le lavage fréquent des mains et le lavage des mains avec du gel hydroalcoolique peuvent causer une sécheresse de la peau. Afin de prévenir cette sécheresse, il est recommandé d’appliquer de la crème hydratante sur les","Non, les épreuves ministérielles n’auront pas lieu. Le passage des élèves au niveau suivant sera basé sur le jugement professionnel de l’enseignant de l’élève en fonction des résultats des deux premières étapes."
Feedback,0,"j'ai 72 ans je vais aller à la pêche au quebec avec un ami de  63 ans en camion est ce possible",Consultez la politique de la plateforme d’hébergement collaboratif en question. La plupart ont convenu de mesures de soutien en lien avec la crise sanitaire actuelle ou prévoient des clauses pour force ma,"ll est possible d’aller livrer de l’épicerie à une personne âgée ou une personne ayant un système immunitaire affaibli uniquement si vous ne présentez aucun symptôme et ne revenez pas de voyage depuis moins de 14 jours. En tout temps, il importe de conserver une distance entre les personnes, d’éviter les contacts directs et de respecter les règles d’hygiène habituelles lorsque vous toussez ou éternuez."
Feedback,0,est-ce que je peux visiter mon frère dans les laurentides,80 % des personnes infectées guérissent sans traitement particulier. Il existe des groupes de personnes à risque de décéder à la suite des complications respiratoires graves si elles sont infectées par le coronavirus. Il pourrait s’agir d’une pneumonie ou d’un syndrome respiratoire aigu. **Les personnes infectées au coronavirus (COVID-19) à risque de décès sont :** *   les personnes âgées de 70 ans et plus; *   les personnes avec les conditions suivantes :     *   maladies chroniques cardiaques;,"Depuis le 13 mars 2020, les visites dans les CHSLD sont interdites afin de protéger les personnes les plus vulnérables ainsi que les travailleuses et travailleurs du réseau de la santé et des services sociaux, sauf pour des raisons humanitaires. Ainsi, dans le cas de la fin de vie imminente, la présence d’une ou deux personnes significatives auprès de la personne n’est pas considérée comme un visiteur."
