Feedback,0,je veux louer mon chalet pour 31 jours et plus,Consultez la politique de la plateforme d’hébergement collaboratif en question. La plupart ont convenu de mesures de soutien en lien avec la crise sanitaire actuelle ou prévoient des clauses pour force ma,"Qu’il se déroule dans un chalet, un centre de villégiature ou tout autre établissement d’hébergement touristique visé par cette mesure, le séjour n’a pas à être écourté s’il a débuté avant le 29 mars 2020, mais il ne peut pas être prolongé. Il faut respecter les directives de santé publique : *   Éviter toute fréquentation des commerces et autres lieux publics à destination. *   Ne pas tenir de rassemblement intérieur ou extérieur."
Feedback,0,"a quand l'ouverture des centre d'achat ","Si vous ou votre enfant avez des irritations de la peau ou une réaction allergique ou inflammatoire de la peau lorsque vous vous lavez les mains avec du gel hydroalcoolique, veuillez cesser l’utilisation de ce produit. Utilisez plutôt de l’eau et du savon pour vous laver les mains. Le lavage fréquent des mains et le lavage des mains avec du gel hydroalcoolique peuvent causer une sécheresse de la peau. Afin de prévenir cette sécheresse, il est recommandé d’appliquer de la crème hydratante sur les",Non. Les épiceries demeurent ouvertes du lundi au samedi inclusivement et les pharmacies demeurent ouvertes selon leurs horaires habituels. Des informations sur l’approvisionnement en médicaments et l’accès aux services pharmaceutiques sont disponibles dans un [document informatif ]( ) à cet effet. Il est possible de consulter la liste des activités et services qui peuvent demeurer ouverts dans la page [Réduction au minimum des services et activités non prioritaires]( ). À noter que le télétravail et le commerce en ligne sont permis en tout temps pour toutes les entreprises.
Feedback,0,peut-on rouler à vélo en groupe de plus de deux personnes,"Les services de transport en commun demeurent opérationnels et représentent un service essentiel pour permettre, notamment, au personnel du réseau de la santé et des services sociaux de se déplacer. Les sociétés de transport du Québec ont accentué la fréquence de l’entretien de leurs véhicules et installations. Les usagers sont tout de même invités à appliquer les consignes sanitaires habituelles et à conserver, dans la mesure du possible, une distance de deux mètres avec les autres personnes pr","Oui, en solitaire. Cependant, les mêmes consignes relatives aux déplacements s’appliquent, c’est-à-dire que ceux-ci devraient se limiter à des raisons médicales et pour le travail, dans un contexte où le télétravail n'est pas possible."
Feedback,0,proches aidantes,80 % des personnes infectées guérissent sans traitement particulier. Il existe des groupes de personnes à risque de décéder à la suite des complications respiratoires graves si elles sont infectées par le coronavirus. Il pourrait s’agir d’une pneumonie ou d’un syndrome respiratoire aigu. **Les personnes infectées au coronavirus (COVID-19) à risque de décès sont :** *   les personnes âgées de 70 ans et plus; *   les personnes avec les conditions suivantes :     *   maladies chroniques cardiaques;,"À l’heure actuelle, les femmes enceintes peuvent être accompagnées par une personne qui leur est chère pour leur accouchement dans les hôpitaux du Québec. Certaines mesures particulières peuvent toutefois être prises par les centres hospitaliers, comme c’est le cas présentement à l’Hôpital général juif de Montréal. Pour obtenir plus d’information à cet effet, les femmes enceintes peuvent contacter leur centre hospitalier."
Feedback,0,puis-je mettre ma maison en vente pendant le confinement?,Consultez la politique de la plateforme d’hébergement collaboratif en question. La plupart ont convenu de mesures de soutien en lien avec la crise sanitaire actuelle ou prévoient des clauses pour force ma,"Les entreprises agricoles, dont les exploitations maraîchères, sont désignées comme des activités de production prioritaires. Les activités de vente d’aliments à la ferme ou dans les marchés publics permanents peuvent être poursuivies, pourvu que les mesures et les consignes d’hygiène et de santé publique soient respectées."
Feedback,0,"est qu'on peut embarquer dans un véhicule avec un ami","Les services de transport en commun demeurent opérationnels et représentent un service essentiel pour permettre, notamment, au personnel du réseau de la santé et des services sociaux de se déplacer. Les sociétés de transport du Québec ont accentué la fréquence de l’entretien de leurs véhicules et installations. Les usagers sont tout de même invités à appliquer les consignes sanitaires habituelles et à conserver, dans la mesure du possible, une distance de deux mètres avec les autres personnes pr","Oui, en solitaire. Cependant, les mêmes consignes relatives aux déplacements s’appliquent, c’est-à-dire que ceux-ci devraient se limiter à des raisons médicales et pour le travail, dans un contexte où le télétravail n'est pas possible."
Feedback,0,est ce contre indiqué d aller travailler lorsquon as des problèmes de coagulation de sang,"Toute personne ayant fréquenté tout lieu public doit surveiller ses symptômes et respecter les consignes sanitaires suivantes : *   [Lavez-vous les mains](https://www.quebec.ca/sante/conseils-et-prevention/prevention-des-accidents-des-lesions-et-des-maladies/lavage-des-mains/) souvent à l'eau tiède courante et au savon pendant au moins 20 secondes. *   Utilisez un désinfectant à base d'alcool si vous n'avez pas accès à de l'eau et à du savon. *   Observez les règles d'hygiène lorsque vous tousse","Les personnes qui reviennent de voyage ne doivent pas se rendre à leur lieu de travail. Dès leur retour au pays, ils ont l’obligation de se placer en isolement durant 14 jours. Les personnes qui ne reviennent pas de voyage et qui ne présentent aucun symptôme sont invitées à se rendre à leur lieu de travail si les [services et activités de leur employeur sont maintenus et sont considérés comme prioritaires]( ). Ces derniers doivent toutefois respecter les règles d’hygiène habituelles. Les personnes qui ne reviennent pas de voyage et qui présentent des symptômes similaires au rhume et à la grippe sont invités à faire preuve de bon sens et d’évaluer la pertinence de se rendre à leur travail en fonction de leur état."
Feedback,0,Aide financière aux études (AFE),*   Privilégiez les produits du Québec au moment de vos achats. Diverses inscriptions facilitent le repérage de ces produits en magasin. Vous pouvez notamment vous renseigner sur le site [Aliments du Québec](https://www.alimentsduquebec.com/fr/produits-dici) . *   Faites vos achats dans des commerces locaux consacrés à l’alimentation ou directement auprès des entreprises agricoles ou de transformation locales. [Le Panier bleu ](https://lepanierbleu.ca/) est une nouvelle plateforme de référence q,"Ce programme peut être jumelé et complémentaire à toutes les autres mesures annoncées du gouvernement fédéral ou provincial pendant la période visée. Remboursement des dépenses admissibles des projets de formation des entreprises : *   100 % des dépenses de 100 000 $ ou moins; *   50 % des dépenses entre 100 000 $ et 500 000 $. *   Remboursement des salaires pouvant atteindre     *   25 % de la masse salariale des travailleurs en formation (salaire maximal admissible de 25 dollars l’heure), si l’entreprise reçoit la subvention salariale d’urgence du Canada de 75 %;     *   90 % de la masse salariale des travailleurs en formation, si l’entreprise reçoit la subvention salariale temporaire du Canada de 10 %;     *   100 % des salaires des travailleurs en formation, si l’entreprise ne reçoit aucune subvention salariale du gouvernement fédéral."
Feedback,0,"bonjour, que doive faire les autres membres de la famille qui ont été en contact avec un adolescent testé positif ? exemple ne plus se présenter au travail ? se placer en quarantaine ? etc ??  merci","Toute personne ayant fréquenté tout lieu public doit surveiller ses symptômes et respecter les consignes sanitaires suivantes : *   [Lavez-vous les mains](https://www.quebec.ca/sante/conseils-et-prevention/prevention-des-accidents-des-lesions-et-des-maladies/lavage-des-mains/) souvent à l'eau tiède courante et au savon pendant au moins 20 secondes. *   Utilisez un désinfectant à base d'alcool si vous n'avez pas accès à de l'eau et à du savon. *   Observez les règles d'hygiène lorsque vous tousse","Vous devez prendre les moyens raisonnables pour éviter de vous absenter. Il est cependant interdit, dans le contexte, d’accepter la présence des enfants dans le milieu de travail. *   Votre traitement est maintenu; *   Le télétravail est recommandé. S’il est impossible d’effectuer vos tâches de cette façon, évaluez la possibilité de réaliser, en télétravail, toutes autres tâches pour lesquelles vous avez les qualifications. Un seul parent peut s’absenter pour assurer la sécurité de la personne. Si le maintien de toute prestation de service en mode télétravail s’avère impossible, le traitement est maintenu. Concernant les ressources externes (consultants), s’ils doivent s’absenter pour assurer la sécurité de leur enfant, c’est à la charge de leur employeur."
Feedback,0,peut-on faire garder les enfants à la maison,"Si vous ou votre enfant avez des irritations de la peau ou une réaction allergique ou inflammatoire de la peau lorsque vous vous lavez les mains avec du gel hydroalcoolique, veuillez cesser l’utilisation de ce produit. Utilisez plutôt de l’eau et du savon pour vous laver les mains. Le lavage fréquent des mains et le lavage des mains avec du gel hydroalcoolique peuvent causer une sécheresse de la peau. Afin de prévenir cette sécheresse, il est recommandé d’appliquer de la crème hydratante sur les","En aucun cas si la personne présente des symptômes de la COVID-19. Il est permis pour un parent de se rendre dans l’une des régions visées pour respecter les modalités relatives à la garde d’un enfant, telles qu’une ordonnance contenue dans un jugement rendu par un tribunal ou une entente de droits d’accès. S’il s’agit d’une entente parentale prise hors Cour, les policiers feront preuve de jugement et de discernement et le passage sera autorisé. En cas de doute, on peut communiquer avec la Clinique d’assistance juridique COVID-19 mise en place par le ministère de la Justice du Québec et le Barreau du Québec, en composant le [1 866 699-9729](+tel:1-866-699-9729)."
Feedback,0,"Est-ce qu’une personne peut, par exemple, se rendre à l’hôpital pour visiter un proche qui est mourant?","Des médicaments en vente libre peuvent être utilisés pour soulager les symptômes de la maladie à coronavirus (COVID‑19). Avant d’en faire usage, lisez attentivement les étiquettes et respectez les doses recommandées. **Il est fortement recommandé de demander conseil à votre pharmacien** avant d’utiliser des médicaments en vente libre en présence de symptômes. Évitez de prendre en même temps des produits qui contiennent les mêmes ingrédients comme du Tylenol MD et du Tylenol sinus",Oui. Les établissements de santé tolèrent les visites en cas de situations exceptionnelles ou humanitaires. Le gouvernement du Québec interdit les visites non essentielles.
Feedback,0,entretient ménager résidentielle ,"Les établissements des secteurs économiques suivants pourront rouvrir : *   l’ensemble des secteurs de l’industrie de la construction; *   les commerces de détail (établissements avec un accès extérieur habituellement utilisé par la clientèle) ainsi que leur chaîne d’approvisionnement; *   les entreprises du secteur manufacturier. Pour connaître les dates et modalités encadrant ces réouvertures, consultez la page [Reprise graduelle des activités en lien avec les mesures de ralentissement de la C","*   Firmes de construction pour réparations d’urgence ou pour fins de sécurité *   Électriciens et plombiers et autres corps de métiers pour des services d’urgence *   Équipements de location *   Aménagement et entretien paysagers (incluant pépinières, centres jardin et commerces de piscines) *   Construction et rénovation d’habitations résidentielles, pour tout immeuble où la prise de possession d’une unité résidentielle doit avoir lieu au plus tard le 31 juillet 2020, incluant la fourniture de biens et de services pouvant être requis aux fins de ces travaux, dont la fourniture de services par les courtiers immobiliers, les arpenteurs-géomètres, les inspecteurs et les évaluateurs en bâtiment et les évaluateurs agréés Consultez la liste des [questions et réponses sur la relance de la construction résidentielle]( )."
Feedback,0,"ma mère elle a un rendez vous a l'hôpital entre région est-ce que je peux aller avec elle a l'hôpital sans avoir d'infraction",80 % des personnes infectées guérissent sans traitement particulier. Il existe des groupes de personnes à risque de décéder à la suite des complications respiratoires graves si elles sont infectées par le coronavirus. Il pourrait s’agir d’une pneumonie ou d’un syndrome respiratoire aigu. **Les personnes infectées au coronavirus (COVID-19) à risque de décès sont :** *   les personnes âgées de 70 ans et plus; *   les personnes avec les conditions suivantes :     *   maladies chroniques cardiaques;,Oui. Les établissements de santé tolèrent les visites en cas de situations exceptionnelles ou humanitaires. Le gouvernement du Québec interdit les visites non essentielles.
Feedback,0,le 12 juin puige aller ouvrir le chalet de mes parents en gaspésie près de percé ,"*   Les hôtels et les motels. *   Les campings désignés pour l’accueil des _snowbirds_, lesquels sont répertoriés sur le site de Camping Québec. Tous les terrains de camping doivent demeurer fermés, à l’exception des terrains qui accueillent les _snowbirds_ n’ayant pas d’autre option de logement en sol québécois. Pour accueillir ces derniers, le camping doit offrir les trois services (eau, électricité, égout) afin de s’assurer que le campeur peut demeurer en confinement obligatoire pendant 14 jo","*   Votre proche se rendra ou sera amené à l’entrée afin d’éviter les déplacements à l’intérieur de la résidence. Les proches doivent organiser le transport. *   Vous ne pourrez pas chercher votre proche si une éclosion de la COVID-19 est déclarée dans la résidence, qu’il présente ou non des symptômes. Le risque de propagation est alors trop élevé. *   Si des besoins importants de services de soutien à domicile sont nécessaires, l’établissement pourrait refuser la sortie de la personne dans l’intérêt de sa sécurité, compte tenu de la limite de capacité actuelle des équipes de soutien à domicile dans le contexte de la pandémie. *   Il n’est pas possible de recevoir des services à domicile à la même hauteur des soins et services offerts en résidence privée pour aînés, le cas échéant."
Feedback,0,"bonjour, étant de la montérégie est ce que je peux faire une balade vers st ferdinant dans le centre du québec.  j‘ai hâte de trotter un peu",80 % des personnes infectées guérissent sans traitement particulier. Il existe des groupes de personnes à risque de décéder à la suite des complications respiratoires graves si elles sont infectées par le coronavirus. Il pourrait s’agir d’une pneumonie ou d’un syndrome respiratoire aigu. **Les personnes infectées au coronavirus (COVID-19) à risque de décès sont :** *   les personnes âgées de 70 ans et plus; *   les personnes avec les conditions suivantes :     *   maladies chroniques cardiaques;,"La liste suivante n’est pas exhaustive. Elle présente les organismes communautaires montréalais reconnus pour desservir principalement la clientèle autochtone, mais non exclusivement. À ce titre, d’autres ressources à Montréal pourraient offrir des services pertinents à la population autochtone. Notez que certains de ces organismes pourraient avoir suspendu, en tout en partie, leurs services suivant les plus récentes directives du gouvernement du Québec en lien avec la COVID-19. *   Café de L’Itinéraire     2103, rue Sainte-Catherine Est     Montréal (Québec)  H2K 2H9     Téléphone : [514 597-0238](tel:+1-514-597-0238) *   Centre d’amitié autochtone de Montréal     2001, boulevard Saint-Laurent     Montréal (Québec)  H2X 2T3     Téléphone : [514 499-1854](tel:+1-514-499-1854) *   Chez Doris     1430, rue Chomedey     Montréal (Québec)  H3H 2A7     Téléphone : [514 937-2341](tel:+1-514-937-2341)"
Feedback,0,"est-ce légal de faire du covoiturage, même si ce n'est pas essentiel","Les services de transport en commun demeurent opérationnels et représentent un service essentiel pour permettre, notamment, au personnel du réseau de la santé et des services sociaux de se déplacer. Les sociétés de transport du Québec ont accentué la fréquence de l’entretien de leurs véhicules et installations. Les usagers sont tout de même invités à appliquer les consignes sanitaires habituelles et à conserver, dans la mesure du possible, une distance de deux mètres avec les autres personnes pr","Les entreprises peuvent reprendre leurs activités de vente, notamment les centres jardin. La [liste des services et activités prioritaires​]( )  est mise à jour de manière continue et elle est en vigueur jusqu’au 4 mai 2020, sous réserve des modifications apportées par le gouvernement. Les entreprises sont invitées à la consulter régulièrement. En matière de santé publique, les producteurs horticoles sont invités à suivre les directives de l’Institut national de santé publique du Québec (INSPQ) : [COVID-19 : Mesures pour les travailleurs agricoles en productions maraîchères et animales]( ) ​. Des directives pour la vente sur place sont en préparation. La production horticole ornementale comprend les productions ornementales qui ne sont pas nécessairement destinées à l’alimentation humaine comme la serriculture ornementale (végétaux en serre), les pépinières, le gazon en plaques et les arbres de Noël.​"
Feedback,0,je vis a st hubert et ma mere a gatineau est ce que je peux aller lui rendre visite,80 % des personnes infectées guérissent sans traitement particulier. Il existe des groupes de personnes à risque de décéder à la suite des complications respiratoires graves si elles sont infectées par le coronavirus. Il pourrait s’agir d’une pneumonie ou d’un syndrome respiratoire aigu. **Les personnes infectées au coronavirus (COVID-19) à risque de décès sont :** *   les personnes âgées de 70 ans et plus; *   les personnes avec les conditions suivantes :     *   maladies chroniques cardiaques;,"Les CHSLD acceptent les visites pour des raisons humanitaires, comme dans le cas de la fin de vie imminente (24-48 heures), la présence d’une ou deux personnes (maximum) auprès du résident est alors permise. Le personnel du CHSLD devra d’abord vérifier qu’aucun visiteur ne présente de symptômes liés à la COVID‑19. Si c’est le cas, des mesures particulières seront appliquées pour assurer la protection des résidents et du personnel. Par la suite, un accompagnement individualisé des visiteurs sera fait afin de s’assurer qu’ils respectent les mesures de prévention et de contrôle des infections. De plus, les visiteurs ne seront pas autorisés à circuler dans le CHSLD à d’autres endroits que celui où se trouve leur proche en fin de vie. Pour les résidents isolés en raison de la COVID‑19, le personnel devra aider le visiteur à mettre et à enlever les équipements de protection individuelle requis."
Feedback,0,Quels sont les emplois visés par les services essentiels?,"Les établissements des secteurs économiques suivants pourront rouvrir : *   l’ensemble des secteurs de l’industrie de la construction; *   les commerces de détail (établissements avec un accès extérieur habituellement utilisé par la clientèle) ainsi que leur chaîne d’approvisionnement; *   les entreprises du secteur manufacturier. Pour connaître les dates et modalités encadrant ces réouvertures, consultez la page [Reprise graduelle des activités en lien avec les mesures de ralentissement de la C",Consultez la [liste des services et activités prioritaires]( ).
Feedback,0,"j'offre un service de garde et de promenade pour animaux , est-ce que je fais partie des entreprises de services qui doivent demeurer fermées?","Les établissements des secteurs économiques suivants pourront rouvrir : *   l’ensemble des secteurs de l’industrie de la construction; *   les commerces de détail (établissements avec un accès extérieur habituellement utilisé par la clientèle) ainsi que leur chaîne d’approvisionnement; *   les entreprises du secteur manufacturier. Pour connaître les dates et modalités encadrant ces réouvertures, consultez la page [Reprise graduelle des activités en lien avec les mesures de ralentissement de la C","L’ordonnance de fermeture des commerces et des services non prioritaires prescrite par le gouvernement, qui prenait effet à compter du mercredi 25 mars à 0 h 01, concerne l’ensemble des commerces et des services non prioritaires comme les services de pension, les activités d’éducation (ex. : maternelles de chiots et cours pour animaux), les services de toilettage et les autres activités connexes (ex. : centre d’agilité). Vous pouvez consulter la page ​[Réduction au minimum des services et activités non prioritaires]( ) .​ Les animaux sont des êtres sensibles qui ont des besoins essentiels. Le propriétaire ou le gardien des animaux doit assurer [leur sécurité et leur bien-être]( ) , en leur fournissant les soins requis (ex. : alimentation et hébergement), malgré la fermeture de son commerce."
Feedback,0,"est-ce que je doit déclarer la pcu dans ma demande de prêt et bourse à l'automne?","Si vous ou votre enfant avez des irritations de la peau ou une réaction allergique ou inflammatoire de la peau lorsque vous vous lavez les mains avec du gel hydroalcoolique, veuillez cesser l’utilisation de ce produit. Utilisez plutôt de l’eau et du savon pour vous laver les mains. Le lavage fréquent des mains et le lavage des mains avec du gel hydroalcoolique peuvent causer une sécheresse de la peau. Afin de prévenir cette sécheresse, il est recommandé d’appliquer de la crème hydratante sur les","Oui. Communiquez avec votre institution financière, qui vous indiquera la marche à suivre."
Feedback,0,est-ce dangereux le covid-19 ?,"En décembre 2019, l'Organisation mondiale de la Santé a été alertée de plusieurs cas de pneumonie à Wuhan, en Chine. Le virus responsable de la maladie ne correspondait à aucun autre virus connu. Le 7 janvier 2020, la Chine a confirmé avoir détecté un nouveau virus de la famille des coronavirus responsable de cette nouvelle maladie nommée la COVID‑19. Pour en savoir plus, consultez la page sur la [Situation du coronavirus (COVID‑19) au Québec](https://www.quebec.ca/sante/problemes-de-sante/a-z/c","Il est possible qu'une personne soit infectée une deuxième fois par la COVID‑19. Toutefois, selon ce qu’il est observé, il s’agit de cas rares et ces cas sont souvent des patients avec des systèmes immunitaires affaiblis. Actuellement, la majorité des gens qui attrapent la COVID‑19 en guérissent et semblent être protégés contre une nouvelle infection par ce virus."
Feedback,0,célébration mariage par notaire,"Concernant les **lieux de cultes**, tous les rassemblements religieux de quelque confession que ce soit devront idéalement être suspendus, à moins d'être essentiels. Dans ce cas, la distanciation physique devra être obs","Afin de protéger la population, les rassemblements intérieurs et extérieurs sont désormais interdits par le gouvernement du Québec. Cette interdiction s’applique à tous les rassemblements intérieurs et extérieurs, à l’exception de rassemblements : *   requis dans un milieu de travail qui n’est pas visé par une suspension du gouvernement du Québec, à condition que les employés maintiennent, dans la mesure du possible, une distance minimale de deux mètres entre eux; *   dans un lieu public visant à obtenir un service ou un bien (commerces, services gouvernementaux, etc.) qui n’est pas visé par une suspension du gouvernement du Québec, à condition que les clients maintiennent, dans la mesure du possible, une distance minimale de deux mètres entre eux; *   dans un moyen de transport, à condition que les usagers maintiennent, dans la mesure du possible, une distance minimale de deux mètres entre eux;"
