QnA,Isolement volontaire,Est-il préférable pour une personne de s’isoler et de rester à la maison pour les semaines à venir même si elle ne revient pas de voyage?,plop,"Le confinement est l’une des mesures qui permettra de réduire la propagation de la COVID-19. Les personnes âgées de 70 ans et plus ainsi que celles ayant un système immunitaire affaibli ou souffrant de maladies chroniques sont invitées à rester à la maison, sauf en cas de nécessité ou d’exception, comme pour se présenter à un rendez-vous médical important. Les visites dans les hôpitaux, les CHSLD, les ressources intermédiaires, les ressources de type familial ainsi que les résidences privées pour aînés sont interdites jusqu’à nouvel ordre. Pour les personnes en bonne santé, il est recommandé d’éviter le plus possible les rassemblements, notamment dans des lieux fermés, et de respecter les consignes sanitaires de base."
QnA,Isolement volontaire,Pour quelle raison doit-on rester à la maison si on ne revient pas de voyage ?,plop,"Le confinement est l’une des mesures qui permettra de réduire la propagation de la COVID-19. Les personnes âgées de 70 ans et plus ainsi que celles ayant un système immunitaire affaibli ou souffrant de maladies chroniques sont invitées à rester à la maison, sauf en cas de nécessité ou d’exception, comme pour se présenter à un rendez-vous médical important. Les visites dans les hôpitaux, les CHSLD, les ressources intermédiaires, les ressources de type familial ainsi que les résidences privées pour aînés sont interdites jusqu’à nouvel ordre. Pour les personnes en bonne santé, il est recommandé d’éviter le plus possible les rassemblements, notamment dans des lieux fermés, et de respecter les consignes sanitaires de base."
QnA,Isolement volontaire,Est-ce que je peux faire du télétravail pour la fonction publique si je suis en isolement ?,plop,Le gouvernement du Québec invite les employeurs à faire preuve de compréhension et de souplesse envers un employé qui revient de voyage ou qui présente des symptômes.
QnA,Isolement volontaire,Une personne de mon entourage direct présente des symptômes. Que faire?,plop,"Avisez votre gestionnaire, qui pourrait vous demander de faire du télétravail, si cet aménagement est possible. Si le maintien de toute prestation de service en mode télétravail est impossible, le traitement sera maintenu. Avant de réintégrer le travail, vous devez vous assurer de respecter les consignes de la santé publique, qui détermine la nécessité d’un test de dépistage de la COVID-19 ou qui énonce la durée de la contagion possible. Selon les données connues actuellement, une personne infectée reste contagieuse encore de 4 à 5 jours après la fin des symptômes."
QnA,Isolement volontaire,"C'est quoi les dispositions prévues dans ma convention collective de la fonction publique?",plop,"Dans le contexte où plusieurs services municipaux sont présentement suspendus, il revient à chaque municipalité d’adopter les mesures qu’elle juge appropriées à sa situation en matière de gestion de son personnel, et ce, dans le respect des lois et des conventions collectives, ces dernières pouvant faire l’objet d’assouplissements convenus avec les associations et les syndicats. Comme tout employeur du Québec, les municipalités sont encouragées à privilégier des stratégies permettant de maintenir en poste le plus grand nombre d’employés possible, tout en prenant les mesures nécessaires pour protéger leur santé et leur sécurité. Une municipalité pourrait, entre autres, privilégier : *   le télétravail; *   le redéploiement dans d’autres fonctions liées aux services essentiels; *   le prêt de service à d’autres organismes municipaux, à des organismes communautaires ou au réseau de la santé."
QnA,Isolement volontaire,Je vis avec une personne qui vient de se faire diagnostiquer le coronavirus (COVID-19). Que faire?,plop,"Si vous présentez des symptômes de la maladie à coronavirus, vous vous sentirez faible et fatigué. Le repos vous aidera à combattre la maladie. Limitez vos contacts avec les autres jusqu’à la fin des symptômes. Vous pouvez reprendre vos activités quand votre état vous le permet. Il est important que vous buviez souvent, parce que la fièvre fait transpirer et vous fait perdre beaucoup de liquide. Il est recommandé de boire au minimum 1,5 litre par jour. Buvez des liquides froids ou tièdes selon vos goûts. Évitez les boissons alcoolisées ou celles contenant de la caféine, comme le café, le thé et les boissons gazeuses. L’alcool et la caféine ont pour effet de faire uriner et d’augmenter les pertes de liquides (déshydratation). Surveillez les signes de déshydratation suivants : *   sensation de soif extrême; *   bouche et langue sèches; *   urines peu fréquentes ou foncées;"
QnA,Isolement volontaire,"Employé de la focntion publique, je peux faire du télétravail, quelle est la durée de l'isolement?",plop,"Si le télétravail est possible, vous pourrez y recourir pour la durée prévue de l’isolement, soit 14 jours consécutifs. S’il est impossible d’effectuer vos tâches de cette façon, votre gestionnaire évaluera la pertinence de vous confier, en télétravail, d’autres tâches pour lesquelles vous avez les compétences. Discutez-en avec votre gestionnaire. Si le maintien de vos tâches en mode télétravail est impossible, votre salaire sera tout de même maintenu. *   L’accès aux locaux est interdit. *   Si le maintien de toute prestation de service en mode télétravail est impossible, le traitement sera maintenu."
QnA,Isolement volontaire,Pendant combien de temps devrais-je rester en isolation ?,plop,"Les personnes qui sont en isolement doivent rester à la maison, surveiller leurs symptômes et appeler au [1 877 644‑4545](tel:+1-877-644-4545) si elles présentent l’un des symptômes suivants : *   apparition ou aggravation d’une toux; *   [fièvre]( ); *   difficultés respiratoires; *   perte soudaine de l’odorat sans congestion nasale, avec ou sans perte de goût. En aucun temps, ces personnes ne doivent sortir à l’extérieur, et ce, même pour aller marcher. Certaines pratiques sont également recommandées si elles habitent avec d’autres personnes qui n’ont pas voyagé. Pour plus de détails sur les consignes à suivre, se référer à la section [Consignes sanitaires]( )."
QnA,Isolement volontaire,4. Vous informez votre gestionnaire que vous devez vous isoler volontairement. À quoi devez-vous vous attendre?,plop,"Votre gestionnaire vous questionnera sur les facteurs de risque à l’origine de ce besoin et vous demandera si cet isolement volontaire vous a été signifié par une autorité compétente. S’il s’agit d’une décision personnelle de votre part, non soutenue par une recommandation d’une autorité compétente, mais que les facteurs de risque apparaissent sérieux, votre gestionnaire vous demandera de communiquer avec une autorité compétente pour confirmer la situation. Si la situation d’isolement volontaire n’est pas reconnue par cette autorité compétente, vous devrez vous présenter au travail. Si vous refusez de vous conformer, vous vous exposerez à des mesures administratives ou disciplinaires."
QnA,Isolement volontaire,Est-que je peux prendre une marche si je suis en isolement?,plop,"Oui, sauf si vous avez reçu la consigne de vous isoler pendant 14 jours. Dans ce cas, vous devez rester confiné à la maison, ce qui inclut aussi que et vous ne pouvez pas sortir marcher jusqu’à la fin de votre isolement. Si vous n’avez pas reçu la consigne de vous isoler : *   Pour les personnes qui vivent dans un CHSLD ou une résidence privée pour aînés ou celles qui sont confiées en ressources intermédiaires et en ressources de type familial (RI‑RTF), les sorties à l’extérieur sont tolérées, mais elles doivent être faites sous supervision. *   Toutes les autres personnes peuvent sortir à l’extérieur pour prendre l’air et marcher. L’important est de garder une distance minimale de 2 mètres (environ 6 pieds) entre vous et les autres personnes qui ne vivent pas sous votre toit."
QnA,Isolement volontaire,Est-il possible de recevoir des voisins qui habitent le même bloc appartement?,plop,"Il est interdit de tenir tout rassemblement intérieur ou extérieur avec des personnes qui ne vivent pas dans la même demeure, ceci inclut des membres de famille immédiate qui habiteraient dans un autre logement. Pour ce qui est des marches, il faut respecter une distance minimale de deux mètres entre l’ensemble des personnes, sauf s’il s’agit de personnes qui habitent la même résidence privée."
QnA,Isolement volontaire,"Si je dois me placer en isolement volontaire, que dois-je faire?",plop,"Les personnes qui sont en isolement doivent rester à la maison, surveiller leurs symptômes et appeler au [1 877 644‑4545](tel:+1-877-644-4545) si elles présentent l’un des symptômes suivants : *   apparition ou aggravation d’une toux; *   [fièvre]( ); *   difficultés respiratoires; *   perte soudaine de l’odorat sans congestion nasale, avec ou sans perte de goût. En aucun temps, ces personnes ne doivent sortir à l’extérieur, et ce, même pour aller marcher. Certaines pratiques sont également recommandées si elles habitent avec d’autres personnes qui n’ont pas voyagé. Pour plus de détails sur les consignes à suivre, se référer à la section [Consignes sanitaires]( )."
QnA,Isolement volontaire,"Si je dois me placer en isolement volontaire, quelles sont les règles à respecter?",plop,"Les personnes qui sont en isolement doivent rester à la maison, surveiller leurs symptômes et appeler au [1 877 644‑4545](tel:+1-877-644-4545) si elles présentent l’un des symptômes suivants : *   apparition ou aggravation d’une toux; *   [fièvre]( ); *   difficultés respiratoires; *   perte soudaine de l’odorat sans congestion nasale, avec ou sans perte de goût. En aucun temps, ces personnes ne doivent sortir à l’extérieur, et ce, même pour aller marcher. Certaines pratiques sont également recommandées si elles habitent avec d’autres personnes qui n’ont pas voyagé. Pour plus de détails sur les consignes à suivre, se référer à la section [Consignes sanitaires]( )."
QnA,Isolement volontaire,"Fonctionnaire Québécois, je n'ai pas d'ordinateur pour faire du télétravail est-ce que je dois me rendre au bureau?",plop,"Si le télétravail est possible, vous pourrez y recourir pour la durée prévue de l’isolement, soit 14 jours consécutifs. S’il est impossible d’effectuer vos tâches de cette façon, votre gestionnaire évaluera la pertinence de vous confier, en télétravail, d’autres tâches pour lesquelles vous avez les compétences. Discutez-en avec votre gestionnaire. Si le maintien de vos tâches en mode télétravail est impossible, votre salaire sera tout de même maintenu. *   L’accès aux locaux est interdit. *   Si le maintien de toute prestation de service en mode télétravail est impossible, le traitement sera maintenu."
QnA,Isolement volontaire,"Quelles sont les mesures à respecter pour l'isolement volontaire?",plop,"Les personnes qui sont en isolement doivent rester à la maison, surveiller leurs symptômes et appeler au [1 877 644‑4545](tel:+1-877-644-4545) si elles présentent l’un des symptômes suivants : *   apparition ou aggravation d’une toux; *   [fièvre]( ); *   difficultés respiratoires; *   perte soudaine de l’odorat sans congestion nasale, avec ou sans perte de goût. En aucun temps, ces personnes ne doivent sortir à l’extérieur, et ce, même pour aller marcher. Certaines pratiques sont également recommandées si elles habitent avec d’autres personnes qui n’ont pas voyagé. Pour plus de détails sur les consignes à suivre, se référer à la section [Consignes sanitaires]( )."
QnA,Isolement volontaire,"Que dois-je faire en cas d'isolement volontaire?",plop,"Les personnes qui sont en isolement doivent rester à la maison, surveiller leurs symptômes et appeler au [1 877 644‑4545](tel:+1-877-644-4545) si elles présentent l’un des symptômes suivants : *   apparition ou aggravation d’une toux; *   [fièvre]( ); *   difficultés respiratoires; *   perte soudaine de l’odorat sans congestion nasale, avec ou sans perte de goût. En aucun temps, ces personnes ne doivent sortir à l’extérieur, et ce, même pour aller marcher. Certaines pratiques sont également recommandées si elles habitent avec d’autres personnes qui n’ont pas voyagé. Pour plus de détails sur les consignes à suivre, se référer à la section [Consignes sanitaires]( )."
QnA,Isolement volontaire,"Si je suis atteint d'une maladie chronique, est-ce obligatoire de m'isoler puisque je ne reviens pas de voyage ?",plop,"Le confinement est l’une des mesures qui permettra de réduire la propagation de la COVID-19. Les personnes âgées de 70 ans et plus ainsi que celles ayant un système immunitaire affaibli ou souffrant de maladies chroniques sont invitées à rester à la maison, sauf en cas de nécessité ou d’exception, comme pour se présenter à un rendez-vous médical important. Les visites dans les hôpitaux, les CHSLD, les ressources intermédiaires, les ressources de type familial ainsi que les résidences privées pour aînés sont interdites jusqu’à nouvel ordre. Pour les personnes en bonne santé, il est recommandé d’éviter le plus possible les rassemblements, notamment dans des lieux fermés, et de respecter les consignes sanitaires de base."
QnA,Isolement volontaire,Est-ce que je peux recevoir quelques amis à souper?,plop,"Il est interdit de tenir tout rassemblement intérieur ou extérieur avec des personnes qui ne vivent pas dans la même demeure, ceci inclut des membres de famille immédiate qui habiteraient dans un autre logement. Pour ce qui est des marches, il faut respecter une distance minimale de deux mètres entre l’ensemble des personnes, sauf s’il s’agit de personnes qui habitent la même résidence privée."
QnA,Isolement volontaire,Je ne fais pas mes tâches habituelles de fonctionnaire Québécois en télétravail est-ce que je suis payé quand même?,plop,"Si une personne salariée ne fournit pas de prestation de travail (par exemple en télétravail), l’employeur n’a pas l'obligation de la rémunérer. Les employeurs sont toutefois invités à faire preuve de compréhension et de souplesse dans les circonstances actuelles. Pour en savoir plus, il est possible de consulter le [site Web de la CNESST]( (COVID-19)) ."
QnA,Isolement volontaire,Est-ce possible de faire des visites en Centre Hospitaliers de longue durée ?,plop,"Depuis le 13 mars 2020, les visites dans les CHSLD sont interdites afin de protéger les personnes les plus vulnérables ainsi que les travailleuses et travailleurs du réseau de la santé et des services sociaux, sauf pour des raisons humanitaires. Ainsi, dans le cas de la fin de vie imminente, la présence d’une ou deux personnes significatives auprès de la personne n’est pas considérée comme un visiteur."
QnA,Isolement volontaire,"C'est quoi l'isolement volontaire?",plop,"Les personnes qui sont en isolement doivent rester à la maison, surveiller leurs symptômes et appeler au [1 877 644‑4545](tel:+1-877-644-4545) si elles présentent l’un des symptômes suivants : *   apparition ou aggravation d’une toux; *   [fièvre]( ); *   difficultés respiratoires; *   perte soudaine de l’odorat sans congestion nasale, avec ou sans perte de goût. En aucun temps, ces personnes ne doivent sortir à l’extérieur, et ce, même pour aller marcher. Certaines pratiques sont également recommandées si elles habitent avec d’autres personnes qui n’ont pas voyagé. Pour plus de détails sur les consignes à suivre, se référer à la section [Consignes sanitaires]( )."
QnA,Secteur bioalimentaire,Quelles sont les mesures de prévention concernant les travailleurs en soins vétérinaires?,plop,"Toutes les mesures nécessaires pour protéger la santé et assurer la sécurité et l’intégrité physique des travailleurs sont prévues. Seules les inspections jugées prioritaires ou critiques sont réalisées en personne. Pour les autres situations, les interventions téléphoniques sont privilégiées. Lorsqu’une inspection doit être réalisée sur les lieux, les employés prennent les mesures nécessaires pour se protéger et protéger la clientèle avec laquelle ils entrent en contact. Pour ce faire : *   L’isolement pour une durée de 14 jours est obligatoire pour tous les inspecteurs qui reviennent de l’étranger ou qui présentent des signes cliniques de fièvre et de toux. *   Les directives de biosécurité habituelles sont maintenues afin de limiter la propagation de tout pathogène. Un sarrau propre doit être utilisé à chaque inspection. Un lavage des mains doit être fait dès l’arrivée sur les lieux d’inspection et avant de quitter."
QnA,Secteur bioalimentaire,"J'aimerais avoir de l'information sur quoi faire si un préparateur d'aliments est testé positif à la COVID.",plop,"Prenez connaissance du [Guide en cas de déclaration d’un cas positif à la COVID-19 dans un établissement alimentaire (PDF 241 Ko)]( ). Les établissements alimentaires peuvent se conformer aux recommandations et adopter de bonnes pratiques pour protéger la clientèle et les employés. Pour en savoir plus, consultez le document [Avis aux exploitants des établissements alimentaires (PDF 136 Ko)]( )."
QnA,Secteur bioalimentaire,mesures pour ceux qui manipulent la nourriture,plop,"S’ils pensent présenter des symptômes de maladie respiratoire, il est important que les manipulateurs d'aliments informent leur employeur. Ils doivent éviter de préparer des aliments pour d'autres personnes et suivre les recommandations de la santé publique. Il est possible qu'un manipulateur d'aliments infecté introduise le virus dans les aliments avec des mains contaminées ou encore en toussant ou en éternuant. Il est peu probable que cela se produise si les personnes en contact avec les aliments dans les entreprises alimentaires suivent les bonnes pratiques d'hygiène personnelle. Ces pratiques contribuent à réduire le risque de transmission de la plupart des maladies d'origine alimentaire : *   lavage de main fréquent et bonne hygiène générale des mains; *   respect des bonnes pratiques d'hygiène et de salubrité alimentaires (voir le [Guide des bonnes pratiques d’hygiène et de salubrité alimentaires]( ) ) *   respect de l’étiquette respiratoire (tousser et éternuer dans le coude);"
QnA,Secteur bioalimentaire,"Quelles sont les mesures de prévention les marchés d'alimentation et les commerces essentiels?",plop,"L’Institut national de santé publique du Québec (INSPQ) a produit une série de documents indiquant les mesures de prévention à mettre en œuvre à l’égard de la COVID-19 dans [différents milieux de travail]( ) , dont les documents suivants : *   ​[Recommandations intérimaires concernant l’industrie de la transformation alimentaire]( ) ; *   [Recommandations intérimaires concernant les marchés d'alimentation et les commerces essentiels]( ) ; *   [Recommandations pour les travailleurs agricoles des productions maraîchères et animales]( ) ; *   [Recommandations intérimaires relatives à l'industrie de la pêche]( ) ; *   [Recommandations intérimaires concernant les livreurs à domicile ]( ) (colis, livraison de restaurant, épicerie, etc. ); *   [Recommandations intérimaires à l'intention des travailleurs en soins vétérinaires]( ) ; *   ​[Recommandations intérimaires concernant l’industrie des abattoirs]( ) ."
QnA,Secteur bioalimentaire,"Est-ce que la vente en ligne et livraison des produits horticoles (pots, substrats, semences, outils de jardinage, arbustes, etc.) est permise?",plop,"Oui, tous les produits horticoles (pots, substrats, semences, outils de jardinage, etc.) peuvent être vendus en ligne et envoyés par livraison au domicile des clients."
QnA,Secteur bioalimentaire,"Que dois-je faire en tant que manipulateur d'aliments pour me protéger et protéger les autres?",plop,"S’ils pensent présenter des symptômes de maladie respiratoire, il est important que les manipulateurs d'aliments informent leur employeur. Ils doivent éviter de préparer des aliments pour d'autres personnes et suivre les recommandations de la santé publique. Il est possible qu'un manipulateur d'aliments infecté introduise le virus dans les aliments avec des mains contaminées ou encore en toussant ou en éternuant. Il est peu probable que cela se produise si les personnes en contact avec les aliments dans les entreprises alimentaires suivent les bonnes pratiques d'hygiène personnelle. Ces pratiques contribuent à réduire le risque de transmission de la plupart des maladies d'origine alimentaire : *   lavage de main fréquent et bonne hygiène générale des mains; *   respect des bonnes pratiques d'hygiène et de salubrité alimentaires (voir le [Guide des bonnes pratiques d’hygiène et de salubrité alimentaires]( ) ) *   respect de l’étiquette respiratoire (tousser et éternuer dans le coude);"
QnA,Secteur bioalimentaire,"Est-ce qu'il existe des documents indiquant quoi faire lorsqu'un préparateur d'aliments est diagnostiqué positif?",plop,"Prenez connaissance du [Guide en cas de déclaration d’un cas positif à la COVID-19 dans un établissement alimentaire (PDF 241 Ko)]( ). Les établissements alimentaires peuvent se conformer aux recommandations et adopter de bonnes pratiques pour protéger la clientèle et les employés. Pour en savoir plus, consultez le document [Avis aux exploitants des établissements alimentaires (PDF 136 Ko)]( )."
QnA,Secteur bioalimentaire,Quelles sont les mesures de prévention à mettre en place dans une entreprise du secteur bioalimentaire?,plop,"L’Institut national de santé publique du Québec (INSPQ) a produit une série de documents indiquant les mesures de prévention à mettre en œuvre à l’égard de la COVID-19 dans [différents milieux de travail]( ) , dont les documents suivants : *   ​[Recommandations intérimaires concernant l’industrie de la transformation alimentaire]( ) ; *   [Recommandations intérimaires concernant les marchés d'alimentation et les commerces essentiels]( ) ; *   [Recommandations pour les travailleurs agricoles des productions maraîchères et animales]( ) ; *   [Recommandations intérimaires relatives à l'industrie de la pêche]( ) ; *   [Recommandations intérimaires concernant les livreurs à domicile ]( ) (colis, livraison de restaurant, épicerie, etc. ); *   [Recommandations intérimaires à l'intention des travailleurs en soins vétérinaires]( ) ; *   ​[Recommandations intérimaires concernant l’industrie des abattoirs]( ) ."
QnA,Secteur bioalimentaire,"J'aimerais avoir de l'information sur quoi faire si un préparateur d'aliments est testé positif à la COVID.",plop,"Prenez connaissance du [Guide en cas de déclaration d’un cas positif à la COVID-19 dans un établissement alimentaire (PDF 241 Ko)]( ). Les établissements alimentaires peuvent se conformer aux recommandations et adopter de bonnes pratiques pour protéger la clientèle et les employés. Pour en savoir plus, consultez le document [Avis aux exploitants des établissements alimentaires (PDF 136 Ko)]( )."
QnA,Secteur bioalimentaire,"Secteur de l'alimentation doit augmenter les fréquences de nettoyage des surfaces",plop,"Les commerçants sont fortement encouragés à adopter, de manière encore plus rigoureuse, les meilleures pratiques de nettoyage et d’assainissement des surfaces en contact ou non avec les aliments. Ils peuvent trouver la documentation relative à ces pratiques dans la page [Nettoyage et assainissement]( ) . Les consommateurs doivent miser sur les règles d’hygiène personnelle de base pour leur sécurité : bien se laver les mains, laver les ustensiles utilisés avant de cuisiner et de manger, bien laver les aliments avant de les consommer, tousser ou éternuer dans le pli du  coude. Il n'y a donc pas lieu de faire des dénonciations."
QnA,Secteur bioalimentaire,"Existe-il un guide si un manipulateur d'aliments est testés positif au coronavirus?",plop,"Prenez connaissance du [Guide en cas de déclaration d’un cas positif à la COVID-19 dans un établissement alimentaire (PDF 241 Ko)]( ). Les établissements alimentaires peuvent se conformer aux recommandations et adopter de bonnes pratiques pour protéger la clientèle et les employés. Pour en savoir plus, consultez le document [Avis aux exploitants des établissements alimentaires (PDF 136 Ko)]( )."
QnA,Secteur bioalimentaire,"Est-ce que la limite de 250 personnes s'applique pour un supermarché?",plop,"La limite de 250 personnes ne s’applique pas à votre établissement. Vous avez donc le choix de prendre les mesures pour la respecter. Le gouvernement du Québec demande aux propriétaires de restaurants et de cafés de fermer toutes leurs salles à manger. Les commandes pour emporter, les livraisons et les services à l’auto demeurent permis."
