Question,Bot
-1,carpool to work,"Des médicaments en vente libre peuvent être utilisés pour soulager les symptômes de la maladie à coronavirus (COVID‑19). Avant d’en faire usage, lisez attentivement les étiquettes et respectez les doses recommandées. **Il est fortement recommandé de demander conseil à votre pharmacien** avant d’utiliser des médicaments en vente libre en présence de symptômes. Évitez de prendre en même temps des produits qui contiennent les mêmes ingrédients comme du Tylenol MD et du Tylenol sinus"
-1,combien de personnes ont décédées du covid ,"Le coronavirus (COVID‑19) peut vivre sur les objets et surfaces. Sa durée de vie est de quelques heures à plusieurs jours. Cela dépend notamment du type de surface (par exemple : cuivre, carton, acier inoxydable, plastique), de la température et de l’humidité ambiante. Il est donc important que vous laviez les comptoirs, les lavabos, les poignées de porte et toutes les surfaces fréquemment touchées par les mains. Le nettoyage et la désinfection sont très efficaces pour éliminer le virus. "
-1,qu'en est-il de nos droits et libertés?,"Si vous ou votre enfant avez des irritations de la peau ou une réaction allergique ou inflammatoire de la peau lorsque vous vous lavez les mains avec du gel hydroalcoolique, veuillez cesser l’utilisation de ce produit. Utilisez plutôt de l’eau et du savon pour vous laver les mains. Le lavage fréquent des mains et le lavage des mains avec du gel hydroalcoolique peuvent causer une sécheresse de la peau. Afin de prévenir cette sécheresse, il est recommandé d’appliquer de la crème hydratante sur les"
-1,combien de cas dans le monde?,"Pour outiller les secteurs offrant des services et activités prioritaires dans la mise en place de mesures de prévention, l’Institut national de santé publique du Québec (INSPQ) a produit différentes recommandations intérimaires. Celles-ci présentent des mesures à appliquer afin de protéger la santé de ceux qui fréquentent ces milieux de travail. Ces documents sont disponibles [sur le site de l’INSPQ](http://www.inspq.qc.ca/covid-19/sante-au-travail) . Des outils à l’attention des établissements"
-1,quand les grands-parents pourront voir leurs petits-enfants?,Les établissements de santé tolèrent les visites en cas de situations exceptionnelles ou humanitaires. Le gouvernement du Québec interdit les visites non essenti
-1,mon enfant asthmatique devrait-il aller à la garderie? ,"Depuis le 13 mars 2020, les visites dans les CHSLD sont interdites afin de protéger les personnes les plus vulnérables ainsi que les travailleuses et travailleurs du réseau de la santé et des services sociaux, sauf pour des raisons humanitaires. Ainsi, dans le cas de la fin de vie imminente, la présence d’une ou deux personnes significatives auprès de la personne est pe"
-1,"j'ai 71 ans, est-ce que je peux aller à l'épicerie?","Seuls les travaux en vue de la prise de possession d’une unité d’habitation résidentielle sont permis. Par ailleurs, la location de chalets et autres habitations de villégiature semblables n’est toujours pas permise. Par « prise de possession », on en"
-1,est-ce que je peux recevoir des colis à la maison?,"Des médicaments en vente libre peuvent être utilisés pour soulager les symptômes de la maladie à coronavirus (COVID‑19). Avant d’en faire usage, lisez attentivement les étiquettes et respectez les doses recommandées. **Il est fortement recommandé de demander conseil à votre pharmacien** avant d’utiliser des médicaments en vente libre en présence de symptômes. Évitez de prendre en même temps des produits qui contiennent les mêmes ingrédients comme du Tylenol MD et du Tylenol sinus"
-1,est-ce que la 5g cause la covid?,"Dans un contexte de pandémie, de nombreuses personnes vivront des réactions de stress, d’anxiété et de déprime. Pour vous aider à minimiser les répercussions de telles réactions dans votre vie, consultez la page [Stress, anxiété et déprime associés à la maladie à coronavirus COVID‑19](https://www.quebec.ca/sante/problemes-de-sante/a-z/coronavirus-2019/stress-anxiete-et-deprime-associes-a-la-maladie-a-coronavirus-covid-19/). Aucun traitement spécifique ni vaccin n’existe pour la COVID‑19. Des tra"
-1,"bonjour, nous pensons qu'un employé fait une fausse déclaration à l'effet qu'il est covid positif afin de pouvoir rester à la maison avec la pcu ",Toute personne ayant fréquenté tout lieu public doit surveiller ses symptômes et respecter les consignes sanitaires suivantes : *   [Lavez-vous les mains](https://www.quebec.ca/sante/conseils-et-prevention/prevention-des-accidents-des-lesions-et-des-maladies/lavage-des-mains/) souvent à l'eau tiède courante et au savon pendant au moins 20 secondes. *   Utilisez un désinfectant à base d'alcool si vous n'avez pas accès à de l'eau et à du savon. *   Observez les règles d'hygiène lorsque vous tousse
-1,hi!  my sister is returning to gatineau in mid-june after spending 6 months in mexico.  she needs a place to quarantine for 2 weeks upon arrival.  are there such places for people in her position?  ,Toute personne ayant fréquenté tout lieu public doit surveiller ses symptômes et respecter les consignes sanitaires suivantes : *   [Lavez-vous les mains](https://www.quebec.ca/sante/conseils-et-prevention/prevention-des-accidents-des-lesions-et-des-maladies/lavage-des-mains/) souvent à l'eau tiède courante et au savon pendant au moins 20 secondes. *   Utilisez un désinfectant à base d'alcool si vous n'avez pas accès à de l'eau et à du savon. *   Observez les règles d'hygiène lorsque vous tousse
-1,when can i open my outdoor patio at my hotel?,"*   Les hôtels et les motels. *   Les campings désignés pour l’accueil des _snowbirds_, lesquels sont répertoriés sur le site de Camping Québec. Tous les terrains de camping doivent demeurer fermés, à l’exception des terrains qui accueillent les _snowbirds_ n’ayant pas d’autre option de logement en sol québécois. Pour accueillir ces derniers, le camping doit offrir les trois services (eau, électricité, égout) afin de s’assurer que le campeur peut demeurer en confinement obligatoire pendant 14 jo"
-1,peux t'on en mourir?,Les établissements de santé tolèrent les visites en cas de situations exceptionnelles ou humanitaires. Le gouvernement du Québec interdit les visites non essenti
-1,bonjour! les déplacements non essentiels sont-ils tolérés en date d’aujourd’hui ?,Consultez la politique de la plateforme d’hébergement collaboratif en question. La plupart ont convenu de mesures de soutien en lien avec la crise sanitaire actuelle ou prévoient des clauses pour force ma
-1,"ma soeur a appris qu'elle a la covid hier et je l'ai vue voici 10 jours, suis-je infecté?","Le coronavirus (COVID‑19) peut vivre sur les objets et surfaces. Sa durée de vie est de quelques heures à plusieurs jours. Cela dépend notamment du type de surface (par exemple : cuivre, carton, acier inoxydable, plastique), de la température et de l’humidité ambiante. Il est donc important que vous laviez les comptoirs, les lavabos, les poignées de porte et toutes les surfaces fréquemment touchées par les mains. Le nettoyage et la désinfection sont très efficaces pour éliminer le virus. "
-1,are small outdoor family gatherings say for a bar-b-q permitted as of now? thank you,Consultez la politique de la plateforme d’hébergement collaboratif en question. La plupart ont convenu de mesures de soutien en lien avec la crise sanitaire actuelle ou prévoient des clauses pour force ma
-1,tout est fermé et je n'ai pas d'argent pour me nourrir,"Des médicaments en vente libre peuvent être utilisés pour soulager les symptômes de la maladie à coronavirus (COVID‑19). Avant d’en faire usage, lisez attentivement les étiquettes et respectez les doses recommandées. **Il est fortement recommandé de demander conseil à votre pharmacien** avant d’utiliser des médicaments en vente libre en présence de symptômes. Évitez de prendre en même temps des produits qui contiennent les mêmes ingrédients comme du Tylenol MD et du Tylenol sinus"
-1,can i drive from new brunswick to the montreal airport? ,"Les services de transport en commun demeurent opérationnels et représentent un service essentiel pour permettre, notamment, au personnel du réseau de la santé et des services sociaux de se déplacer. Les sociétés de transport du Québec ont accentué la fréquence de l’entretien de leurs véhicules et installations. Les usagers sont tout de même invités à appliquer les consignes sanitaires habituelles et à conserver, dans la mesure du possible, une distance de deux mètres avec les autres personnes pr"
-1,"j’ai le covid, qu’est-ce que je dois faire ","Les principaux symptômes de la COVID‑19 sont les suivants : *   fièvre :     *   chez l’enfant : 38 °C (100,4 °F) et plus (température rectale),     *   chez l’adulte : 38 °C (100,4 °F) et plus (température buccale),     *   chez la personne aînée : 37,8 °C (100 °F) et plus (température buccale),     *   ou 1,1 °C de plus que la valeur habituelle d’une personne; *   apparition ou aggravation d’une toux; *   difficultés respiratoires; *   chez l’enfant : 38 °C (100,4 °F) et plus (température rect"
-1,est-ce que mon chien peut transmettre la covid,"Le coronavirus (COVID‑19) peut vivre sur les objets et surfaces. Sa durée de vie est de quelques heures à plusieurs jours. Cela dépend notamment du type de surface (par exemple : cuivre, carton, acier inoxydable, plastique), de la température et de l’humidité ambiante. Il est donc important que vous laviez les comptoirs, les lavabos, les poignées de porte et toutes les surfaces fréquemment touchées par les mains. Le nettoyage et la désinfection sont très efficaces pour éliminer le virus. "
-1,est-ce que je peux attraper la covid en allant à l'épicerie,"Concernant les **lieux de cultes**, tous les rassemblements religieux de quelque confession que ce soit devront idéalement être suspendus, à moins d'être essentiels. Dans ce cas, la distanciation physique devra être obs"
-1,est-ce que je peux être immunisé contre la covid,"Les principaux symptômes de la COVID‑19 sont les suivants : *   fièvre :     *   chez l’enfant : 38 °C (100,4 °F) et plus (température rectale),     *   chez l’adulte : 38 °C (100,4 °F) et plus (température buccale),     *   chez la personne aînée : 37,8 °C (100 °F) et plus (température buccale),     *   ou 1,1 °C de plus que la valeur habituelle d’une personne; *   apparition ou aggravation d’une toux; *   difficultés respiratoires; *   chez l’enfant : 38 °C (100,4 °F) et plus (température rect"
-1,mal de ventre?,"Des médicaments en vente libre peuvent être utilisés pour soulager les symptômes de la maladie à coronavirus (COVID‑19). Avant d’en faire usage, lisez attentivement les étiquettes et respectez les doses recommandées. **Il est fortement recommandé de demander conseil à votre pharmacien** avant d’utiliser des médicaments en vente libre en présence de symptômes. Évitez de prendre en même temps des produits qui contiennent les mêmes ingrédients comme du Tylenol MD et du Tylenol sinus"
-1,je suis diabétique suis je a risque,"Les principaux symptômes de la COVID‑19 sont les suivants : *   fièvre :     *   chez l’enfant : 38 °C (100,4 °F) et plus (température rectale),     *   chez l’adulte : 38 °C (100,4 °F) et plus (température buccale),     *   chez la personne aînée : 37,8 °C (100 °F) et plus (température buccale),     *   ou 1,1 °C de plus que la valeur habituelle d’une personne; *   apparition ou aggravation d’une toux; *   difficultés respiratoires; *   chez l’enfant : 38 °C (100,4 °F) et plus (température rect"
-1,puis-je aller chez le dentiste,"Les personnes âgées de 70 ans et plus sont les plus à risque de décéder des complications de la COVID-19. Ainsi, afin de protéger leur santé, il est demandé à ces personnes de rester à la maison, sauf en cas de nécessité ou d’exception, comme pour se présenter à un rendez-vous médical. En effet, protéger leur santé signifie aussi maintenir leurs suivis médicaux habituels et consulter en cas de besoin. Plusieurs cliniques offrent d’ailleurs des consultations téléphoniques. Certains travailleurs e"
-1,"j'ai perdu mon travail, je me sens déprimé","Les employeurs sont invités à faire preuve de souplesse dans les horaires de travail de leur personnel, de façon, par exemple, à limiter les foules présentes dans le transport en commun aux heures de pointe. Dans l’objectif d’éviter d’engorger les hôpitaux, le gouvernement du Québec demande aux employeurs de ne pas demander de billets de médecin à leur personnel devant se placer en isolement. Lorsque possible, les employeurs sont également invités à favoriser le télétr"
-1,je veux aller voir ma copine est ce que je peux,"Depuis le 13 mars 2020, les visites dans les CHSLD sont interdites afin de protéger les personnes les plus vulnérables ainsi que les travailleuses et travailleurs du réseau de la santé et des services sociaux, sauf pour des raisons humanitaires. Ainsi, dans le cas de la fin de vie imminente, la présence d’une ou deux personnes significatives auprès de la personne est pe"
-1,le port de masque est-il obligatoire ?,"Les services de transport en commun demeurent opérationnels et représentent un service essentiel pour permettre, notamment, au personnel du réseau de la santé et des services sociaux de se déplacer. Les sociétés de transport du Québec ont accentué la fréquence de l’entretien de leurs véhicules et installations. Les usagers sont tout de même invités à appliquer les consignes sanitaires habituelles et à conserver, dans la mesure du possible, une distance de deux mètres avec les autres personnes pr"
-1,est-que le covid-19 a les mêmes symptômes que le rhume ?,"Les principaux symptômes de la COVID‑19 sont les suivants : *   fièvre :     *   chez l’enfant : 38 °C (100,4 °F) et plus (température rectale),     *   chez l’adulte : 38 °C (100,4 °F) et plus (température buccale),     *   chez la personne aînée : 37,8 °C (100 °F) et plus (température buccale),     *   ou 1,1 °C de plus que la valeur habituelle d’une personne; *   apparition ou aggravation d’une toux; *   difficultés respiratoires; *   chez l’enfant : 38 °C (100,4 °F) et plus (température rect"
-1,la technologie 5g est-elle liée à la covid,"Le risque de complications graves pour les personnes atteintes de la COVID‑19 augmente avec l’âge, mais il est présent même chez les jeunes adultes. Le risque de décès à la suite de complications respiratoires graves (pneumonie ou syndrome respiratoire aigu) dues à la COVID‑19 est particulièrement élevé chez : *   les personnes âgées de 70 ans et plus; *   les personnes ayant un système immunitaire affaibli; *   les personnes atteintes de maladies chroniques telles que :     *   le diabète;    "
-1,puis-je rouler à vélo avec des amis?,"Les services de transport en commun demeurent opérationnels et représentent un service essentiel pour permettre, notamment, au personnel du réseau de la santé et des services sociaux de se déplacer. Les sociétés de transport du Québec ont accentué la fréquence de l’entretien de leurs véhicules et installations. Les usagers sont tout de même invités à appliquer les consignes sanitaires habituelles et à conserver, dans la mesure du possible, une distance de deux mètres avec les autres personnes pr"
-1,j'ai mal aux orteils,"Des médicaments en vente libre peuvent être utilisés pour soulager les symptômes de la maladie à coronavirus (COVID‑19). Avant d’en faire usage, lisez attentivement les étiquettes et respectez les doses recommandées. **Il est fortement recommandé de demander conseil à votre pharmacien** avant d’utiliser des médicaments en vente libre en présence de symptômes. Évitez de prendre en même temps des produits qui contiennent les mêmes ingrédients comme du Tylenol MD et du Tylenol sinus"
-1,c'est quoi la chloroquine?,"Des médicaments en vente libre peuvent être utilisés pour soulager les symptômes de la maladie à coronavirus (COVID‑19). Avant d’en faire usage, lisez attentivement les étiquettes et respectez les doses recommandées. **Il est fortement recommandé de demander conseil à votre pharmacien** avant d’utiliser des médicaments en vente libre en présence de symptômes. Évitez de prendre en même temps des produits qui contiennent les mêmes ingrédients comme du Tylenol MD et du Tylenol sinus"
-1,cimetières,"Concernant les **lieux de cultes**, tous les rassemblements religieux de quelque confession que ce soit devront idéalement être suspendus, à moins d'être essentiels. Dans ce cas, la distanciation physique devra être obs"
-1,c'est quoi le plan de déconfinement?,"Des médicaments en vente libre peuvent être utilisés pour soulager les symptômes de la maladie à coronavirus (COVID‑19). Avant d’en faire usage, lisez attentivement les étiquettes et respectez les doses recommandées. **Il est fortement recommandé de demander conseil à votre pharmacien** avant d’utiliser des médicaments en vente libre en présence de symptômes. Évitez de prendre en même temps des produits qui contiennent les mêmes ingrédients comme du Tylenol MD et du Tylenol sinus"
-1,est-ce que je peux apporter mon fils chez iga,"Il est possible d’aller livrer de l’épicerie à une personne âgée ou une personne ayant un système immunitaire affaibli uniquement si vous ne présentez aucun symptôme et ne revenez pas de voyage depuis moins de 14 jours. En tout temps, il importe de conserver une distance entre les personnes, d’éviter les contacts directs et de respecter les règles d’hygiène habituelles lorsque vous toussez ou éte"
-1,allez-vous augmenter le nombre de tests?,*   [Soutenir le réseau de la santé](https://jecontribuecovid19.gouv.qc.ca/)  *   [Participer à une étude clinique pour le traitement des personnes testées positives à la COVID-19](https://www.colcorona.org/)  *   [Donnez du sang](https://www.hema-quebec.qc.ca/index.fr.html)  *   [Devenir bénévole](https://www.jebenevol
-1,examin a la saaq,"Lorsque les milieux de stage ont confirmé la continuité de leurs services, que les étudiants évoluent dans un endroit où les consignes de la Santé publique sont respectées et que les étudiants peuvent réaliser leur stage, par exemple en recourant au télétravail, les stages sont possibles. Cependant, aucun étudiant ne peut être pénalisé en raison de son incapacité à répondre aux exig"
-1,qu'arrive-t-il aux personnes qui décèdent? ,Les établissements de santé tolèrent les visites en cas de situations exceptionnelles ou humanitaires. Le gouvernement du Québec interdit les visites non essenti
-1,ou est-ce que je peux me faire tester pour la covid-19,"Les principaux symptômes de la COVID‑19 sont les suivants : *   fièvre :     *   chez l’enfant : 38 °C (100,4 °F) et plus (température rectale),     *   chez l’adulte : 38 °C (100,4 °F) et plus (température buccale),     *   chez la personne aînée : 37,8 °C (100 °F) et plus (température buccale),     *   ou 1,1 °C de plus que la valeur habituelle d’une personne; *   apparition ou aggravation d’une toux; *   difficultés respiratoires; *   chez l’enfant : 38 °C (100,4 °F) et plus (température rect"
-1,"je suis asthmatique, est-ce que la covid est dangereuse pour moi?","Les principaux symptômes de la COVID‑19 sont les suivants : *   fièvre :     *   chez l’enfant : 38 °C (100,4 °F) et plus (température rectale),     *   chez l’adulte : 38 °C (100,4 °F) et plus (température buccale),     *   chez la personne aînée : 37,8 °C (100 °F) et plus (température buccale),     *   ou 1,1 °C de plus que la valeur habituelle d’une personne; *   apparition ou aggravation d’une toux; *   difficultés respiratoires; *   chez l’enfant : 38 °C (100,4 °F) et plus (température rect"
-1,bonjour!   est-ce qu'une personne demeurant dans un ri peut sortir à l'extérieur de sa résidence afin de s'asseoir et de profiter de l'air pur et du soleil..merci,Toute personne ayant fréquenté tout lieu public doit surveiller ses symptômes et respecter les consignes sanitaires suivantes : *   [Lavez-vous les mains](https://www.quebec.ca/sante/conseils-et-prevention/prevention-des-accidents-des-lesions-et-des-maladies/lavage-des-mains/) souvent à l'eau tiède courante et au savon pendant au moins 20 secondes. *   Utilisez un désinfectant à base d'alcool si vous n'avez pas accès à de l'eau et à du savon. *   Observez les règles d'hygiène lorsque vous tousse
-1,mes enfants doivent-ils aller à l'école,"Des médicaments en vente libre peuvent être utilisés pour soulager les symptômes de la maladie à coronavirus (COVID‑19). Avant d’en faire usage, lisez attentivement les étiquettes et respectez les doses recommandées. **Il est fortement recommandé de demander conseil à votre pharmacien** avant d’utiliser des médicaments en vente libre en présence de symptômes. Évitez de prendre en même temps des produits qui contiennent les mêmes ingrédients comme du Tylenol MD et du Tylenol sinus"
-1,es ce que entretien residentiel dans les maison priver es autoriser?,Consultez la politique de la plateforme d’hébergement collaboratif en question. La plupart ont convenu de mesures de soutien en lien avec la crise sanitaire actuelle ou prévoient des clauses pour force ma
-1,maladie chronique retour travail,"Les employeurs sont invités à faire preuve de souplesse dans les horaires de travail de leur personnel, de façon, par exemple, à limiter les foules présentes dans le transport en commun aux heures de pointe. Dans l’objectif d’éviter d’engorger les hôpitaux, le gouvernement du Québec demande aux employeurs de ne pas demander de billets de médecin à leur personnel devant se placer en isolement. Lorsque possible, les employeurs sont également invités à favoriser le télétr"
-1,est-ce que l'épicerie est un foyer d'éclosion?,"Les établissements des secteurs économiques suivants pourront rouvrir : *   l’ensemble des secteurs de l’industrie de la construction; *   les commerces de détail (établissements avec un accès extérieur habituellement utilisé par la clientèle) ainsi que leur chaîne d’approvisionnement; *   les entreprises du secteur manufacturier. Pour connaître les dates et modalités encadrant ces réouvertures, consultez la page [Reprise graduelle des activités en lien avec les mesures de ralentissement de la C"
-1,combien de temps avant la fin de l'épidémie,Toute personne ayant fréquenté tout lieu public doit surveiller ses symptômes et respecter les consignes sanitaires suivantes : *   [Lavez-vous les mains](https://www.quebec.ca/sante/conseils-et-prevention/prevention-des-accidents-des-lesions-et-des-maladies/lavage-des-mains/) souvent à l'eau tiède courante et au savon pendant au moins 20 secondes. *   Utilisez un désinfectant à base d'alcool si vous n'avez pas accès à de l'eau et à du savon. *   Observez les règles d'hygiène lorsque vous tousse
-1,how many people can come into a takeout restaurant ,"Des médicaments en vente libre peuvent être utilisés pour soulager les symptômes de la maladie à coronavirus (COVID‑19). Avant d’en faire usage, lisez attentivement les étiquettes et respectez les doses recommandées. **Il est fortement recommandé de demander conseil à votre pharmacien** avant d’utiliser des médicaments en vente libre en présence de symptômes. Évitez de prendre en même temps des produits qui contiennent les mêmes ingrédients comme du Tylenol MD et du Tylenol sinus"
-1,j'aimerais des précisions sur comment me protéger? ,"Les principaux symptômes de la COVID‑19 sont les suivants : *   fièvre :     *   chez l’enfant : 38 °C (100,4 °F) et plus (température rectale),     *   chez l’adulte : 38 °C (100,4 °F) et plus (température buccale),     *   chez la personne aînée : 37,8 °C (100 °F) et plus (température buccale),     *   ou 1,1 °C de plus que la valeur habituelle d’une personne; *   apparition ou aggravation d’une toux; *   difficultés respiratoires; *   chez l’enfant : 38 °C (100,4 °F) et plus (température rect"
-1,est-ce que l'on est immuniser après avoir eu la covid ?,Toute personne ayant fréquenté tout lieu public doit surveiller ses symptômes et respecter les consignes sanitaires suivantes : *   [Lavez-vous les mains](https://www.quebec.ca/sante/conseils-et-prevention/prevention-des-accidents-des-lesions-et-des-maladies/lavage-des-mains/) souvent à l'eau tiède courante et au savon pendant au moins 20 secondes. *   Utilisez un désinfectant à base d'alcool si vous n'avez pas accès à de l'eau et à du savon. *   Observez les règles d'hygiène lorsque vous tousse
