Question,Bot
1,"une personne infectée m'a visité voici 2 jours, comment dois-je désinfecter?","Le coronavirus (COVID‑19) peut vivre sur les objets et surfaces. Sa durée de vie est de quelques heures à plusieurs jours. Cela dépend notamment du type de surface (par exemple : cuivre, carton, acier inoxydable, plastique), de la température et de l’humidité ambiante. Il est donc important que vous laviez les comptoirs, les lavabos, les poignées de porte et toutes les surfaces fréquemment touchées par les mains. Le nettoyage et la désinfection sont très efficaces pour éliminer le virus. "
1,C'est quoi le covid?,"Les principaux symptômes de la COVID‑19 sont les suivants : *   fièvre :     *   chez l’enfant : 38 °C (100,4 °F) et plus (température rectale),     *   chez l’adulte : 38 °C (100,4 °F) et plus (température buccale),     *   chez la personne aînée : 37,8 °C (100 °F) et plus (température buccale),     *   ou 1,1 °C de plus que la valeur habituelle d’une personne; *   apparition ou aggravation d’une toux; *   difficultés respiratoires; *   chez l’enfant : 38 °C (100,4 °F) et plus (température rect"
1,est-ce que le québec conseille de porter un masque ?,"Le port du couvre-visage est recommandé dans les lieux publics lorsque la distanciation physique n'est pas possible. Cela peut se produire, par exemple, en se rendant à l’épicerie ou en prenant le transport en commun. Le port du couvre-visage dans les lieux publics doit obligatoirement s’accompagner des autres mesures de protection, comme l’application des mesures d’hygiène et de distanciation physique. Pour en savoir plus, consultez la section [Consignes sanitaire pour tous](https://www.quebec."
1,est-ce qu'il y a un risque de transmission avec la nourriture? ,Il n’existe actuellement aucune preuve suggérant que la nourriture est une source ou une voie probable de transmission de la COVID-19. Le lavage usuel des fruits et légumes et l’application des bonnes pratiques de préparation d’aliments sont toujours recomm
1,laver les fruits et légumes,"Des médicaments en vente libre peuvent être utilisés pour soulager les symptômes de la maladie à coronavirus (COVID‑19). Avant d’en faire usage, lisez attentivement les étiquettes et respectez les doses recommandées. **Il est fortement recommandé de demander conseil à votre pharmacien** avant d’utiliser des médicaments en vente libre en présence de symptômes. Évitez de prendre en même temps des produits qui contiennent les mêmes ingrédients comme du Tylenol MD et du Tylenol sinus"
1,est ce que je dois porter un masque?,"Le port du couvre-visage est recommandé dans les lieux publics lorsque la distanciation physique n'est pas possible. Cela peut se produire, par exemple, en se rendant à l’épicerie ou en prenant le transport en commun. Le port du couvre-visage dans les lieux publics doit obligatoirement s’accompagner des autres mesures de protection, comme l’application des mesures d’hygiène et de distanciation physique. Si vous êtes malade, restez à la maison. Si vous devez vous rendre à la clinique ou à l’hôpit"
1,est-ce que je peux aller chasser?,"Les dates pour l’ouverture des saisons de chasse et de pêche sont maintenues, mais les amateurs de chasse et de pêche seront tenus de respecter les interdictions gouvernementales. Ainsi, ils devront se conformer en tout temps aux directives et recommandations de la Direction nationale de la santé publique visant à endiguer l’épidémie de COVID-19, notamment : *   Éviter de se déplacer d’une région ou d’une ville à l’autre, sauf en cas de nécessité. Les déplacements en lien avec les loisirs ne son"
1,est-ce que mon chien peut attraper le covid-19,"Tout indique que la COVID-19 se transmet de personne à personne à la suite d’un contact étroit. Rien n’indique que les animaux jouent un rôle dans la propagation de la maladie. Au Québec, aucune évidence ne suggère un risque d’infection des humains par les animaux ou par des produits animaux. Des cas de transmission de l'humain vers certains animaux à la suite de contacts étroits ont été établis dans quelques pays. Les connaissances actuelles indiquent notamment que les chats, les furets et les "
1,est-ce que je peux prendre le métro,"Les services de transport en commun demeurent opérationnels et représentent un service essentiel pour permettre, notamment, au personnel du réseau de la santé et des services sociaux de se déplacer. Les sociétés de transport du Québec ont accentué la fréquence de l’entretien de leurs véhicules et installations. Les usagers sont tout de même invités à appliquer les consignes sanitaires habituelles et à conserver, dans la mesure du possible, une distance de deux mètres avec les autres personnes pr"
1,"je suis propriétaire de chalets pour location, puis-je recommencer à louer à des touristes?",Consultez la [liste des services et activités prioritaires](https://www.quebec.ca/sante/problemes-de-sante/a-z/coronavirus-2019/fermeture-endroits-publics-commerces-services-covi
1,est-ce que j'ai droit à des congés de maladies?,"Les employeurs sont invités à faire preuve de souplesse dans les horaires de travail de leur personnel, de façon, par exemple, à limiter les foules présentes dans le transport en commun aux heures de pointe. Dans l’objectif d’éviter d’engorger les hôpitaux, le gouvernement du Québec demande aux employeurs de ne pas demander de billets de médecin à leur personnel devant se placer en isolement. Lorsque possible, les employeurs sont également invités à favoriser le télétr"
1,qui peut garder mes enfant?,"Si vous ou votre enfant avez des irritations de la peau ou une réaction allergique ou inflammatoire de la peau lorsque vous vous lavez les mains avec du gel hydroalcoolique, veuillez cesser l’utilisation de ce produit. Utilisez plutôt de l’eau et du savon pour vous laver les mains. Le lavage fréquent des mains et le lavage des mains avec du gel hydroalcoolique peuvent causer une sécheresse de la peau. Afin de prévenir cette sécheresse, il est recommandé d’appliquer de la crème hydratante sur les"
1,est-ce que je peux aller aider ma màre dans sa résidence de personnes âgées,"Depuis le 13 mars 2020, les visites dans les CHSLD sont interdites afin de protéger les personnes les plus vulnérables ainsi que les travailleuses et travailleurs du réseau de la santé et des services sociaux, sauf pour des raisons humanitaires. Ainsi, dans le cas de la fin de vie imminente, la présence d’une ou deux personnes significatives auprès de la personne est pe"
1,je ne me sens pas bien,"Les principaux symptômes de la COVID‑19 sont les suivants : *   fièvre :     *   chez l’enfant : 38 °C (100,4 °F) et plus (température rectale),     *   chez l’adulte : 38 °C (100,4 °F) et plus (température buccale),     *   chez la personne aînée : 37,8 °C (100 °F) et plus (température buccale),     *   ou 1,1 °C de plus que la valeur habituelle d’une personne; *   apparition ou aggravation d’une toux; *   difficultés respiratoires; *   chez l’enfant : 38 °C (100,4 °F) et plus (température rect"
1,Soutenir le réseau de la santé,*   [Soutenir le réseau de la santé](https://jecontribuecovid19.gouv.qc.ca/)  *   [Participer à une étude clinique pour le traitement des personnes testées positives à la COVID-19](https://www.colcorona.org/)  *   [Soutenir le réseau des services de garde éducatifs à l'enfance](https://www.quebec.ca/famille-et-soutien-aux-personnes/servicesgardeeducatifsenfance-covid19/#c58397) *   [Donnez du sang](https://www.hema-quebec.qc.ca/index.fr.html)  *   [Devenir bénévole](https://www.jebenevol
1,"je suis malade, où dois-je appeler?","Les principaux symptômes de la COVID‑19 sont les suivants : *   fièvre :     *   chez l’enfant : 38 °C (100,4 °F) et plus (température rectale),     *   chez l’adulte : 38 °C (100,4 °F) et plus (température buccale),     *   chez la personne aînée : 37,8 °C (100 °F) et plus (température buccale),     *   ou 1,1 °C de plus que la valeur habituelle d’une personne; *   apparition ou aggravation d’une toux; *   difficultés respiratoires; *   chez l’enfant : 38 °C (100,4 °F) et plus (température rect"
1,suis-je contagieux,"Dans un contexte de pandémie, de nombreuses personnes vivront des réactions de stress, d’anxiété et de déprime. Pour vous aider à minimiser les répercussions de telles réactions dans votre vie, consultez la page [Stress, anxiété et déprime associés à la maladie à coronavirus COVID‑19](https://www.quebec.ca/sante/problemes-de-sante/a-z/coronavirus-2019/stress-anxiete-et-deprime-associes-a-la-maladie-a-coronavirus-covid-19/). Aucun traitement spécifique ni vaccin n’existe pour la COVID‑19. Des tra"
1,c’est quoi la covid-19?,Toute personne ayant fréquenté tout lieu public doit surveiller ses symptômes et respecter les consignes sanitaires suivantes : *   [Lavez-vous les mains](https://www.quebec.ca/sante/conseils-et-prevention/prevention-des-accidents-des-lesions-et-des-maladies/lavage-des-mains/) souvent à l'eau tiède courante et au savon pendant au moins 20 secondes. *   Utilisez un désinfectant à base d'alcool si vous n'avez pas accès à de l'eau et à du savon. *   Observez les règles d'hygiène lorsque vous tousse
1,comment se protéger?,Toute personne ayant fréquenté tout lieu public doit surveiller ses symptômes et respecter les consignes sanitaires suivantes : *   [Lavez-vous les mains](https://www.quebec.ca/sante/conseils-et-prevention/prevention-des-accidents-des-lesions-et-des-maladies/lavage-des-mains/) souvent à l'eau tiède courante et au savon pendant au moins 20 secondes. *   Utilisez un désinfectant à base d'alcool si vous n'avez pas accès à de l'eau et à du savon. *   Observez les règles d'hygiène lorsque vous tousse
1,est-ce que je peux me faire livrer de la nourriture,Il n’existe actuellement aucune preuve suggérant que la nourriture est une source ou une voie probable de transmission de la COVID-19. Le lavage usuel des fruits et légumes et l’application des bonnes pratiques de préparation d’aliments sont toujours recomm
1,Les voyages à l'ère de la pandémie,"Misez sur des stratégies de socialisation à distance, qui vous aideront à maintenir et même augmenter les liens avec vos proches en utilisant des moyens de communication alternatifs. Il ne faut pas minimiser les effets positifs de la socialisation à distance, puisque le maintien de vos relations sociales a un impact positif sur votre santé physique et psychologique dans chaque étape de la vie. Par exemple, vous pouvez utiliser des moyens de communication directs, indirects ou encore vous montrer"
1,est-ce que c'est comme la grippe ?,"Des médicaments en vente libre peuvent être utilisés pour soulager les symptômes de la maladie à coronavirus (COVID‑19). Avant d’en faire usage, lisez attentivement les étiquettes et respectez les doses recommandées. **Il est fortement recommandé de demander conseil à votre pharmacien** avant d’utiliser des médicaments en vente libre en présence de symptômes. Évitez de prendre en même temps des produits qui contiennent les mêmes ingrédients comme du Tylenol MD et du Tylenol sinus"
1,est-ce qu'une personne peut en décéder?,Les établissements de santé tolèrent les visites en cas de situations exceptionnelles ou humanitaires. Le gouvernement du Québec interdit les visites non essenti
1,devrais-je porter un masque pour aller faire mon épicerie?,"Le port du couvre-visage est recommandé dans les lieux publics lorsque la distanciation physique n'est pas possible. Cela peut se produire, par exemple, en se rendant à l’épicerie ou en prenant le transport en commun. Le port du couvre-visage dans les lieux publics doit obligatoirement s’accompagner des autres mesures de protection, comme l’application des mesures d’hygiène et de distanciation physique. Pour en savoir plus, consultez la section [Consignes sanitaire pour tous](https://www.quebec."
1,est ce que le covid-19 survit longtemps sur les objets?,"Le coronavirus (COVID‑19) peut vivre sur les objets et surfaces. Sa durée de vie est de quelques heures à plusieurs jours. Cela dépend notamment du type de surface (par exemple : cuivre, carton, acier inoxydable, plastique), de la température et de l’humidité ambiante. Il est donc important que vous laviez les comptoirs, les lavabos, les poignées de porte et toutes les surfaces fréquemment touchées par les mains. Le nettoyage et la désinfection sont très efficaces pour éliminer le virus. "
1,est-ce que je suis obligée de porter un masque pour sortir de la maison?,"Le port du couvre-visage est recommandé dans les lieux publics lorsque la distanciation physique n'est pas possible. Cela peut se produire, par exemple, en se rendant à l’épicerie ou en prenant le transport en commun. Le port du couvre-visage dans les lieux publics doit obligatoirement s’accompagner des autres mesures de protection, comme l’application des mesures d’hygiène et de distanciation physique. Pour en savoir plus, consultez la section [Consignes sanitaire pour tous](https://www.quebec."
1,Comment soulager les maux de gorge?,"Des médicaments en vente libre peuvent être utilisés pour soulager les symptômes de la maladie à coronavirus (COVID‑19). Avant d’en faire usage, lisez attentivement les étiquettes et respectez les doses recommandées. **Il est fortement recommandé de demander conseil à votre pharmacien** avant d’utiliser des médicaments en vente libre en présence de symptômes. Évitez de prendre en même temps des produits qui contiennent les mêmes ingrédients comme du Tylenol MD et du Tylenol sinus"
1,"je suis un chauffeur uber, puis-je travailler?","Les services de transport en commun demeurent opérationnels et représentent un service essentiel pour permettre, notamment, au personnel du réseau de la santé et des services sociaux de se déplacer. Les sociétés de transport du Québec ont accentué la fréquence de l’entretien de leurs véhicules et installations. Les usagers sont tout de même invités à appliquer les consignes sanitaires habituelles et à conserver, dans la mesure du possible, une distance de deux mètres avec les autres personnes pr"
1,est ce que les masques c'est obligatoire,"Le port du couvre-visage est recommandé dans les lieux publics lorsque la distanciation physique n'est pas possible. Cela peut se produire, par exemple, en se rendant à l’épicerie ou en prenant le transport en commun. Le port du couvre-visage dans les lieux publics doit obligatoirement s’accompagner des autres mesures de protection, comme l’application des mesures d’hygiène et de distanciation physique. Si vous êtes malade, restez à la maison. Si vous devez vous rendre à la clinique ou à l’hôpit"
1,suis-je malade,"Les principaux symptômes de la COVID‑19 sont les suivants : *   fièvre :     *   chez l’enfant : 38 °C (100,4 °F) et plus (température rectale),     *   chez l’adulte : 38 °C (100,4 °F) et plus (température buccale),     *   chez la personne aînée : 37,8 °C (100 °F) et plus (température buccale),     *   ou 1,1 °C de plus que la valeur habituelle d’une personne; *   apparition ou aggravation d’une toux; *   difficultés respiratoires; *   chez l’enfant : 38 °C (100,4 °F) et plus (température rect"
1,"je suis un chauffeur uber, puis-je travailler?","Les services de transport en commun demeurent opérationnels et représentent un service essentiel pour permettre, notamment, au personnel du réseau de la santé et des services sociaux de se déplacer. Les sociétés de transport du Québec ont accentué la fréquence de l’entretien de leurs véhicules et installations. Les usagers sont tout de même invités à appliquer les consignes sanitaires habituelles et à conserver, dans la mesure du possible, une distance de deux mètres avec les autres personnes pr"
1,est-ce que la saaq est ouverte?,"Des médicaments en vente libre peuvent être utilisés pour soulager les symptômes de la maladie à coronavirus (COVID‑19). Avant d’en faire usage, lisez attentivement les étiquettes et respectez les doses recommandées. **Il est fortement recommandé de demander conseil à votre pharmacien** avant d’utiliser des médicaments en vente libre en présence de symptômes. Évitez de prendre en même temps des produits qui contiennent les mêmes ingrédients comme du Tylenol MD et du Tylenol sinus"
1,est-ce qu'il existe un vaccin,"Des médicaments en vente libre peuvent être utilisés pour soulager les symptômes de la maladie à coronavirus (COVID‑19). Avant d’en faire usage, lisez attentivement les étiquettes et respectez les doses recommandées. **Il est fortement recommandé de demander conseil à votre pharmacien** avant d’utiliser des médicaments en vente libre en présence de symptômes. Évitez de prendre en même temps des produits qui contiennent les mêmes ingrédients comme du Tylenol MD et du Tylenol sinus"
1,est-ce que mon ami peut venir m’aider à déménager?,"Les services de transport en commun demeurent opérationnels et représentent un service essentiel pour permettre, notamment, au personnel du réseau de la santé et des services sociaux de se déplacer. Les sociétés de transport du Québec ont accentué la fréquence de l’entretien de leurs véhicules et installations. Les usagers sont tout de même invités à appliquer les consignes sanitaires habituelles et à conserver, dans la mesure du possible, une distance de deux mètres avec les autres personnes pr"
1,est-ce que la saaq est ouverte?,"Les services de transport en commun demeurent opérationnels et représentent un service essentiel pour permettre, notamment, au personnel du réseau de la santé et des services sociaux de se déplacer. Les sociétés de transport du Québec ont accentué la fréquence de l’entretien de leurs véhicules et installations. Les usagers sont tout de même invités à appliquer les consignes sanitaires habituelles et à conserver, dans la mesure du possible, une distance de deux mètres avec les autres personnes pr"
1,comment se protéger de la covid ,Toute personne ayant fréquenté tout lieu public doit surveiller ses symptômes et respecter les consignes sanitaires suivantes : *   [Lavez-vous les mains](https://www.quebec.ca/sante/conseils-et-prevention/prevention-des-accidents-des-lesions-et-des-maladies/lavage-des-mains/) souvent à l'eau tiède courante et au savon pendant au moins 20 secondes. *   Utilisez un désinfectant à base d'alcool si vous n'avez pas accès à de l'eau et à du savon. *   Observez les règles d'hygiène lorsque vous tousse
1,ai-je le droit de visiter un aîné?,Les établissements de santé tolèrent les visites en cas de situations exceptionnelles ou humanitaires. Le gouvernement du Québec interdit les visites non essenti
1,différence entre grippe et covid-19,"Des médicaments en vente libre peuvent être utilisés pour soulager les symptômes de la maladie à coronavirus (COVID‑19). Avant d’en faire usage, lisez attentivement les étiquettes et respectez les doses recommandées. **Il est fortement recommandé de demander conseil à votre pharmacien** avant d’utiliser des médicaments en vente libre en présence de symptômes. Évitez de prendre en même temps des produits qui contiennent les mêmes ingrédients comme du Tylenol MD et du Tylenol sinus"
1,je pense avoir la covid,"Les principaux symptômes de la COVID‑19 sont les suivants : *   fièvre :     *   chez l’enfant : 38 °C (100,4 °F) et plus (température rectale),     *   chez l’adulte : 38 °C (100,4 °F) et plus (température buccale),     *   chez la personne aînée : 37,8 °C (100 °F) et plus (température buccale),     *   ou 1,1 °C de plus que la valeur habituelle d’une personne; *   apparition ou aggravation d’une toux; *   difficultés respiratoires; *   chez l’enfant : 38 °C (100,4 °F) et plus (température rect"
1,porter un masque est-ce bien ?,"Le port du couvre-visage est recommandé dans les lieux publics lorsque la distanciation physique n'est pas possible. Cela peut se produire, par exemple, en se rendant à l’épicerie ou en prenant le transport en commun. Le port du couvre-visage dans les lieux publics doit obligatoirement s’accompagner des autres mesures de protection, comme l’application des mesures d’hygiène et de distanciation physique. Pour en savoir plus, consultez la section [Consignes sanitaire pour tous](https://www.quebec."
1,est-ce que mes amis peuvent m'aider à déménager?,"Les services de transport en commun demeurent opérationnels et représentent un service essentiel pour permettre, notamment, au personnel du réseau de la santé et des services sociaux de se déplacer. Les sociétés de transport du Québec ont accentué la fréquence de l’entretien de leurs véhicules et installations. Les usagers sont tout de même invités à appliquer les consignes sanitaires habituelles et à conserver, dans la mesure du possible, une distance de deux mètres avec les autres personnes pr"
1,est-ce que le port du masque est obligatoire?,"Le port du couvre-visage est recommandé dans les lieux publics lorsque la distanciation physique n'est pas possible. Cela peut se produire, par exemple, en se rendant à l’épicerie ou en prenant le transport en commun. Le port du couvre-visage dans les lieux publics doit obligatoirement s’accompagner des autres mesures de protection, comme l’application des mesures d’hygiène et de distanciation physique. Pour en savoir plus, consultez la section [Consignes sanitaire pour tous](https://www.quebec."
1,je me sens pas bien que faire?,Toute personne ayant fréquenté tout lieu public doit surveiller ses symptômes et respecter les consignes sanitaires suivantes : *   [Lavez-vous les mains](https://www.quebec.ca/sante/conseils-et-prevention/prevention-des-accidents-des-lesions-et-des-maladies/lavage-des-mains/) souvent à l'eau tiède courante et au savon pendant au moins 20 secondes. *   Utilisez un désinfectant à base d'alcool si vous n'avez pas accès à de l'eau et à du savon. *   Observez les règles d'hygiène lorsque vous tousse
1,est-ce que les hôtels sont ouverts ?,Consultez la politique de la plateforme d’hébergement collaboratif en question. La plupart ont convenu de mesures de soutien en lien avec la crise sanitaire actuelle ou prévoient des clauses pour force ma
1,d'ou vient le covid ,"En décembre 2019, l'Organisation mondiale de la Santé a été alertée de plusieurs cas de pneumonie à Wuhan, en Chine. Le virus responsable de la maladie ne correspondait à aucun autre virus connu. Le 7 janvier 2020, la Chine a confirmé avoir détecté un nouveau virus de la famille des coronavirus responsable de cette nouvelle maladie nommée la COVID‑19. Pour en savoir plus, consultez la page sur la [Situation du coronavirus (COVID‑19) au Québec](https://www.quebec.ca/sante/problemes-de-sante/a-z/c"
1,"j,ai attrapé la covid, que dois-je faire ?","Les principaux symptômes de la COVID‑19 sont les suivants : *   fièvre :     *   chez l’enfant : 38 °C (100,4 °F) et plus (température rectale),     *   chez l’adulte : 38 °C (100,4 °F) et plus (température buccale),     *   chez la personne aînée : 37,8 °C (100 °F) et plus (température buccale),     *   ou 1,1 °C de plus que la valeur habituelle d’une personne; *   apparition ou aggravation d’une toux; *   difficultés respiratoires; *   chez l’enfant : 38 °C (100,4 °F) et plus (température rect"
1,comment soulager les maux de gorge,"Des médicaments en vente libre peuvent être utilisés pour soulager les symptômes de la maladie à coronavirus (COVID‑19). Avant d’en faire usage, lisez attentivement les étiquettes et respectez les doses recommandées. **Il est fortement recommandé de demander conseil à votre pharmacien** avant d’utiliser des médicaments en vente libre en présence de symptômes. Évitez de prendre en même temps des produits qui contiennent les mêmes ingrédients comme du Tylenol MD et du Tylenol sinus"
1,"j'ai de la température et je suis trés fatigué et un mal de gorge, je fais quoi??","Des médicaments en vente libre peuvent être utilisés pour soulager les symptômes de la maladie à coronavirus (COVID‑19). Avant d’en faire usage, lisez attentivement les étiquettes et respectez les doses recommandées. **Il est fortement recommandé de demander conseil à votre pharmacien** avant d’utiliser des médicaments en vente libre en présence de symptômes. Évitez de prendre en même temps des produits qui contiennent les mêmes ingrédients comme du Tylenol MD et du Tylenol sinus"
1,C'est quoi le covid?,Toute personne ayant fréquenté tout lieu public doit surveiller ses symptômes et respecter les consignes sanitaires suivantes : *   [Lavez-vous les mains](https://www.quebec.ca/sante/conseils-et-prevention/prevention-des-accidents-des-lesions-et-des-maladies/lavage-des-mains/) souvent à l'eau tiède courante et au savon pendant au moins 20 secondes. *   Utilisez un désinfectant à base d'alcool si vous n'avez pas accès à de l'eau et à du savon. *   Observez les règles d'hygiène lorsque vous tousse
