Question,Bot
0,"j'aimerai allez en mauricie, est-ce que les chemins sont ouvert","Des médicaments en vente libre peuvent être utilisés pour soulager les symptômes de la maladie à coronavirus (COVID‑19). Avant d’en faire usage, lisez attentivement les étiquettes et respectez les doses recommandées. **Il est fortement recommandé de demander conseil à votre pharmacien** avant d’utiliser des médicaments en vente libre en présence de symptômes. Évitez de prendre en même temps des produits qui contiennent les mêmes ingrédients comme du Tylenol MD et du Tylenol sinus"
0,Les transports en commun,"Les services de transport en commun demeurent opérationnels et représentent un service essentiel pour permettre, notamment, au personnel du réseau de la santé et des services sociaux de se déplacer. Les sociétés de transport du Québec ont accentué la fréquence de l’entretien de leurs véhicules et installations. Les usagers sont tout de même invités à appliquer les consignes sanitaires habituelles et à conserver, dans la mesure du possible, une distance de deux mètres avec les autres personnes pr"
0,Informations pour les parents d’enfants de 0 à 17 ans,"Il est possible d’aller livrer de l’épicerie à une personne âgée ou une personne ayant un système immunitaire affaibli uniquement si vous ne présentez aucun symptôme et ne revenez pas de voyage depuis moins de 14 jours. En tout temps, il importe de conserver une distance entre les personnes, d’éviter les contacts directs et de respecter les règles d’hygiène habituelles lorsque vous toussez ou éte"
0,covid ,"En décembre 2019, l'Organisation mondiale de la Santé a été alertée de plusieurs cas de pneumonie à Wuhan, en Chine. Le virus responsable de la maladie ne correspondait à aucun autre virus connu. Le 7 janvier 2020, la Chine a confirmé avoir détecté un nouveau virus de la famille des coronavirus responsable de cette nouvelle maladie nommée la COVID‑19. Pour en savoir plus, consultez la page sur la [Situation du coronavirus (COVID‑19) au Québec](https://www.quebec.ca/sante/problemes-de-sante/a-z/c"
0,c'est quoi les symptômes,"Les principaux symptômes de la COVID‑19 sont les suivants : *   fièvre :     *   chez l’enfant : 38 °C (100,4 °F) et plus (température rectale),     *   chez l’adulte : 38 °C (100,4 °F) et plus (température buccale),     *   chez la personne aînée : 37,8 °C (100 °F) et plus (température buccale),     *   ou 1,1 °C de plus que la valeur habituelle d’une personne; *   apparition ou aggravation d’une toux; *   difficultés respiratoires; *   chez l’enfant : 38 °C (100,4 °F) et plus (température rect"
0,voyager en auto avec quelqun qui n a pas la meme adresse possible ou pas,"Les services de transport en commun demeurent opérationnels et représentent un service essentiel pour permettre, notamment, au personnel du réseau de la santé et des services sociaux de se déplacer. Les sociétés de transport du Québec ont accentué la fréquence de l’entretien de leurs véhicules et installations. Les usagers sont tout de même invités à appliquer les consignes sanitaires habituelles et à conserver, dans la mesure du possible, une distance de deux mètres avec les autres personnes pr"
0,bonjour es ce que escalade de rocher est ouvert a tous ? et si oui es ce qu ont peut aller sur un site dans les laurentides car l'escalade ce fais en montagne. moi je suis de st eustache et j'aimerais aller mont heights es-ce possible?,Consultez la politique de la plateforme d’hébergement collaboratif en question. La plupart ont convenu de mesures de soutien en lien avec la crise sanitaire actuelle ou prévoient des clauses pour force ma
0,je veux louer mon chalet pour 31 jours et plus,Consultez la politique de la plateforme d’hébergement collaboratif en question. La plupart ont convenu de mesures de soutien en lien avec la crise sanitaire actuelle ou prévoient des clauses pour force ma
0,are there any restrictions on how many customers/employees are allowed in a space of square footage ?,"Les établissements des secteurs économiques suivants pourront rouvrir : *   l’ensemble des secteurs de l’industrie de la construction; *   les commerces de détail (établissements avec un accès extérieur habituellement utilisé par la clientèle) ainsi que leur chaîne d’approvisionnement; *   les entreprises du secteur manufacturier. Pour connaître les dates et modalités encadrant ces réouvertures, consultez la page [Reprise graduelle des activités en lien avec les mesures de ralentissement de la C"
0,auto personnel pas le trabsport en commun,"Des médicaments en vente libre peuvent être utilisés pour soulager les symptômes de la maladie à coronavirus (COVID‑19). Avant d’en faire usage, lisez attentivement les étiquettes et respectez les doses recommandées. **Il est fortement recommandé de demander conseil à votre pharmacien** avant d’utiliser des médicaments en vente libre en présence de symptômes. Évitez de prendre en même temps des produits qui contiennent les mêmes ingrédients comme du Tylenol MD et du Tylenol sinus"
0,c’est quoi le covid-19 covid-19,"Les principaux symptômes de la COVID‑19 sont les suivants : *   fièvre :     *   chez l’enfant : 38 °C (100,4 °F) et plus (température rectale),     *   chez l’adulte : 38 °C (100,4 °F) et plus (température buccale),     *   chez la personne aînée : 37,8 °C (100 °F) et plus (température buccale),     *   ou 1,1 °C de plus que la valeur habituelle d’une personne; *   apparition ou aggravation d’une toux; *   difficultés respiratoires; *   chez l’enfant : 38 °C (100,4 °F) et plus (température rect"
0,motorcycle ,*   [Société de l'assurance automobile du Québec (SAAQ)](https://saaq.gouv.qc.ca/salle-de-presse/covid-19-foire-aux-quest
0,session cegep automne,"Si vous ou votre enfant avez des irritations de la peau ou une réaction allergique ou inflammatoire de la peau lorsque vous vous lavez les mains avec du gel hydroalcoolique, veuillez cesser l’utilisation de ce produit. Utilisez plutôt de l’eau et du savon pour vous laver les mains. Le lavage fréquent des mains et le lavage des mains avec du gel hydroalcoolique peuvent causer une sécheresse de la peau. Afin de prévenir cette sécheresse, il est recommandé d’appliquer de la crème hydratante sur les"
0,puis-je voir ma blonde si je n'habite pas à la mème adresse qu'elle ,"Des médicaments en vente libre peuvent être utilisés pour soulager les symptômes de la maladie à coronavirus (COVID‑19). Avant d’en faire usage, lisez attentivement les étiquettes et respectez les doses recommandées. **Il est fortement recommandé de demander conseil à votre pharmacien** avant d’utiliser des médicaments en vente libre en présence de symptômes. Évitez de prendre en même temps des produits qui contiennent les mêmes ingrédients comme du Tylenol MD et du Tylenol sinus"
0,can i go to mass on sunday,"Concernant les **lieux de cultes**, tous les rassemblements religieux de quelque confession que ce soit devront idéalement être suspendus, à moins d'être essentiels. Dans ce cas, la distanciation physique devra être obs"
0,"j'ai un salon de toilettage, est-ce que je peux ouvrir?",Il n’existe actuellement aucune preuve suggérant que la nourriture est une source ou une voie probable de transmission de la COVID-19. Le lavage usuel des fruits et légumes et l’application des bonnes pratiques de préparation d’aliments sont toujours recomm
0,c'est quoi covid-19?,"En décembre 2019, l'Organisation mondiale de la Santé a été alertée de plusieurs cas de pneumonie à Wuhan, en Chine. Le virus responsable de la maladie ne correspondait à aucun autre virus connu. Le 7 janvier 2020, la Chine a confirmé avoir détecté un nouveau virus de la famille des coronavirus responsable de cette nouvelle maladie nommée la COVID‑19. Pour en savoir plus, consultez la page sur la [Situation du coronavirus (COVID‑19) au Québec](https://www.quebec.ca/sante/problemes-de-sante/a-z/c"
0,je veux savoir si je suis malade?,"Les principaux symptômes de la COVID‑19 sont les suivants : *   fièvre :     *   chez l’enfant : 38 °C (100,4 °F) et plus (température rectale),     *   chez l’adulte : 38 °C (100,4 °F) et plus (température buccale),     *   chez la personne aînée : 37,8 °C (100 °F) et plus (température buccale),     *   ou 1,1 °C de plus que la valeur habituelle d’une personne; *   apparition ou aggravation d’une toux; *   difficultés respiratoires; *   chez l’enfant : 38 °C (100,4 °F) et plus (température rect"
0,les animaux ont des besoins les cheveux trop long ou un manque de teinture c est superflu mais le bien être d un animal qui a besoin de se faire entretenir c est important et me semble aucunement dangeureux ,"Les établissements des secteurs économiques suivants pourront rouvrir : *   l’ensemble des secteurs de l’industrie de la construction; *   les commerces de détail (établissements avec un accès extérieur habituellement utilisé par la clientèle) ainsi que leur chaîne d’approvisionnement; *   les entreprises du secteur manufacturier. Pour connaître les dates et modalités encadrant ces réouvertures, consultez la page [Reprise graduelle des activités en lien avec les mesures de ralentissement de la C"
0,monfils travaille a l'hôpital  service covit19 peut il me rendre visite  à la maison en respectant la distanciation et port de masque,"Concernant les **lieux de cultes**, tous les rassemblements religieux de quelque confession que ce soit devront idéalement être suspendus, à moins d'être essentiels. Dans ce cas, la distanciation physique devra être obs"
0,dfsadfsadfsadfsadf,"Concernant les **lieux de cultes**, tous les rassemblements religieux de quelque confession que ce soit devront idéalement être suspendus, à moins d'être essentiels. Dans ce cas, la distanciation physique devra être obs"
0,j'ai 72 ans je vais aller à la pêche au quebec avec un ami de  63 ans en camion est ce possible,Consultez la politique de la plateforme d’hébergement collaboratif en question. La plupart ont convenu de mesures de soutien en lien avec la crise sanitaire actuelle ou prévoient des clauses pour force ma
0,co-voiturage,"Des médicaments en vente libre peuvent être utilisés pour soulager les symptômes de la maladie à coronavirus (COVID‑19). Avant d’en faire usage, lisez attentivement les étiquettes et respectez les doses recommandées. **Il est fortement recommandé de demander conseil à votre pharmacien** avant d’utiliser des médicaments en vente libre en présence de symptômes. Évitez de prendre en même temps des produits qui contiennent les mêmes ingrédients comme du Tylenol MD et du Tylenol sinus"
0,"j,ai 80 ans je peux prendre  ma voiture  faire un  tour sans debarquer",Consultez la politique de la plateforme d’hébergement collaboratif en question. La plupart ont convenu de mesures de soutien en lien avec la crise sanitaire actuelle ou prévoient des clauses pour force ma
0,formation professionnel cmm ,"Lorsque les milieux de stage ont confirmé la continuité de leurs services, que les étudiants évoluent dans un endroit où les consignes de la Santé publique sont respectées et que les étudiants peuvent réaliser leur stage, par exemple en recourant au télétravail, les stages sont possibles. Cependant, aucun étudiant ne peut être pénalisé en raison de son incapacité à répondre aux exig"
0,la pêche est ouverte ?,"Les dates pour l’ouverture des saisons de chasse et de pêche sont maintenues, mais les amateurs de chasse et de pêche seront tenus de respecter les interdictions gouvernementales. Ainsi, ils devront se conformer en tout temps aux directives et recommandations de la Direction nationale de la santé publique visant à endiguer l’épidémie de COVID-19, notamment : *   Éviter de se déplacer d’une région ou d’une ville à l’autre, sauf en cas de nécessité. Les déplacements en lien avec les loisirs ne son"
0,puis-je aller à l'école,"Des médicaments en vente libre peuvent être utilisés pour soulager les symptômes de la maladie à coronavirus (COVID‑19). Avant d’en faire usage, lisez attentivement les étiquettes et respectez les doses recommandées. **Il est fortement recommandé de demander conseil à votre pharmacien** avant d’utiliser des médicaments en vente libre en présence de symptômes. Évitez de prendre en même temps des produits qui contiennent les mêmes ingrédients comme du Tylenol MD et du Tylenol sinus"
0,sports,"Oui, il est recommandé d’élaborer un plan particulier d’intervention en cas d’épidémie ou de pandémie. Le ministère des Affaires municipales et de l’Habitation a préparé un guide pour soutenir le milieu municipal à cet égard : *   [Guide pour l’élaboration d’un Plan particulier d’intervention en cas d’épidémie et de pandémie à l’intention des municipalités (PDF 1,14 Mo)](https://cdn-contenu.quebec.ca/cdn-contenu/adm/min/affaires-municipales/publications-adm/documents/COVID-19/covid19_guide_aux_m"
0,Les stages pour étudiant,"Lorsque les milieux de stage ont confirmé la continuité de leurs services, que les étudiants évoluent dans un endroit où les consignes de la Santé publique sont respectées et que les étudiants peuvent réaliser leur stage, par exemple en recourant au télétravail, les stages sont possibles. Cependant, aucun étudiant ne peut être pénalisé en raison de son incapacité à répondre aux exig"
0,peut on faire du co voiturage ,"Les services de transport en commun demeurent opérationnels et représentent un service essentiel pour permettre, notamment, au personnel du réseau de la santé et des services sociaux de se déplacer. Les sociétés de transport du Québec ont accentué la fréquence de l’entretien de leurs véhicules et installations. Les usagers sont tout de même invités à appliquer les consignes sanitaires habituelles et à conserver, dans la mesure du possible, une distance de deux mètres avec les autres personnes pr"
0,j'ai 82 ans  je peux prendre ma voiture pour aller  faire tour  sans debarquer de ma voiture,"Les services de transport en commun demeurent opérationnels et représentent un service essentiel pour permettre, notamment, au personnel du réseau de la santé et des services sociaux de se déplacer. Les sociétés de transport du Québec ont accentué la fréquence de l’entretien de leurs véhicules et installations. Les usagers sont tout de même invités à appliquer les consignes sanitaires habituelles et à conserver, dans la mesure du possible, une distance de deux mètres avec les autres personnes pr"
0,est-ce que je peux louer motel ma maison n'est pas prête pour le 29 mai,Consultez la politique de la plateforme d’hébergement collaboratif en question. La plupart ont convenu de mesures de soutien en lien avec la crise sanitaire actuelle ou prévoient des clauses pour force ma
0,salon de toilettage,Il n’existe actuellement aucune preuve suggérant que la nourriture est une source ou une voie probable de transmission de la COVID-19. Le lavage usuel des fruits et légumes et l’application des bonnes pratiques de préparation d’aliments sont toujours recomm
0,i would like to go to a mass,"Des médicaments en vente libre peuvent être utilisés pour soulager les symptômes de la maladie à coronavirus (COVID‑19). Avant d’en faire usage, lisez attentivement les étiquettes et respectez les doses recommandées. **Il est fortement recommandé de demander conseil à votre pharmacien** avant d’utiliser des médicaments en vente libre en présence de symptômes. Évitez de prendre en même temps des produits qui contiennent les mêmes ingrédients comme du Tylenol MD et du Tylenol sinus"
0,attends le droit d'aller faire un tour chez quelqu'un,"Si vous ou votre enfant avez des irritations de la peau ou une réaction allergique ou inflammatoire de la peau lorsque vous vous lavez les mains avec du gel hydroalcoolique, veuillez cesser l’utilisation de ce produit. Utilisez plutôt de l’eau et du savon pour vous laver les mains. Le lavage fréquent des mains et le lavage des mains avec du gel hydroalcoolique peuvent causer une sécheresse de la peau. Afin de prévenir cette sécheresse, il est recommandé d’appliquer de la crème hydratante sur les"
0,est ce que 5 personnes ne vivant pas au même toit peuvent se rassembler à 2 mètres de distance ,Toute personne ayant fréquenté tout lieu public doit surveiller ses symptômes et respecter les consignes sanitaires suivantes : *   [Lavez-vous les mains](https://www.quebec.ca/sante/conseils-et-prevention/prevention-des-accidents-des-lesions-et-des-maladies/lavage-des-mains/) souvent à l'eau tiède courante et au savon pendant au moins 20 secondes. *   Utilisez un désinfectant à base d'alcool si vous n'avez pas accès à de l'eau et à du savon. *   Observez les règles d'hygiène lorsque vous tousse
0,combien de personne ont droit d'être dans la voiture en même temps,"Les services de transport en commun demeurent opérationnels et représentent un service essentiel pour permettre, notamment, au personnel du réseau de la santé et des services sociaux de se déplacer. Les sociétés de transport du Québec ont accentué la fréquence de l’entretien de leurs véhicules et installations. Les usagers sont tout de même invités à appliquer les consignes sanitaires habituelles et à conserver, dans la mesure du possible, une distance de deux mètres avec les autres personnes pr"
0,what is covid ,"Les principaux symptômes de la COVID‑19 sont les suivants : *   fièvre :     *   chez l’enfant : 38 °C (100,4 °F) et plus (température rectale),     *   chez l’adulte : 38 °C (100,4 °F) et plus (température buccale),     *   chez la personne aînée : 37,8 °C (100 °F) et plus (température buccale),     *   ou 1,1 °C de plus que la valeur habituelle d’une personne; *   apparition ou aggravation d’une toux; *   difficultés respiratoires; *   chez l’enfant : 38 °C (100,4 °F) et plus (température rect"
0,Reset the conversation,"Oui, en cas de nécessité. Cependant, dans la mesure du possible, il est préférable d’éviter de les amener à l’intérieur des comm"
0,suis-je malade?,"Les principaux symptômes de la COVID‑19 sont les suivants : *   fièvre :     *   chez l’enfant : 38 °C (100,4 °F) et plus (température rectale),     *   chez l’adulte : 38 °C (100,4 °F) et plus (température buccale),     *   chez la personne aînée : 37,8 °C (100 °F) et plus (température buccale),     *   ou 1,1 °C de plus que la valeur habituelle d’une personne; *   apparition ou aggravation d’une toux; *   difficultés respiratoires; *   chez l’enfant : 38 °C (100,4 °F) et plus (température rect"
0,i would like to go to a mass,"Concernant les **lieux de cultes**, tous les rassemblements religieux de quelque confession que ce soit devront idéalement être suspendus, à moins d'être essentiels. Dans ce cas, la distanciation physique devra être obs"
0," nous sommes de mtl, et voulons aller a notre club de chasse qui est dans une autre region, pouvons nous y aller.",Les établissements de santé tolèrent les visites en cas de situations exceptionnelles ou humanitaires. Le gouvernement du Québec interdit les visites non essenti
0,"j'ai des symptômes, je dois appeler quel numéro?","Les principaux symptômes de la COVID‑19 sont les suivants : *   fièvre :     *   chez l’enfant : 38 °C (100,4 °F) et plus (température rectale),     *   chez l’adulte : 38 °C (100,4 °F) et plus (température buccale),     *   chez la personne aînée : 37,8 °C (100 °F) et plus (température buccale),     *   ou 1,1 °C de plus que la valeur habituelle d’une personne; *   apparition ou aggravation d’une toux; *   difficultés respiratoires; *   chez l’enfant : 38 °C (100,4 °F) et plus (température rect"
0,ma mère a 72ans et ça fait plus de 2mois que je l’ai pas vu elle habite à 15 min de chez nous est-ce maintenant est permis de la rendre visite ,"Des médicaments en vente libre peuvent être utilisés pour soulager les symptômes de la maladie à coronavirus (COVID‑19). Avant d’en faire usage, lisez attentivement les étiquettes et respectez les doses recommandées. **Il est fortement recommandé de demander conseil à votre pharmacien** avant d’utiliser des médicaments en vente libre en présence de symptômes. Évitez de prendre en même temps des produits qui contiennent les mêmes ingrédients comme du Tylenol MD et du Tylenol sinus"
0,Est-ce que je peux voir ma blonde,"Les services de transport en commun demeurent opérationnels et représentent un service essentiel pour permettre, notamment, au personnel du réseau de la santé et des services sociaux de se déplacer. Les sociétés de transport du Québec ont accentué la fréquence de l’entretien de leurs véhicules et installations. Les usagers sont tout de même invités à appliquer les consignes sanitaires habituelles et à conserver, dans la mesure du possible, une distance de deux mètres avec les autres personnes pr"
0,Comment protéger mes passagers et moi-même lorsqu'ils montent dans mon taxi?,"Les services de transport en commun demeurent opérationnels et représentent un service essentiel pour permettre, notamment, au personnel du réseau de la santé et des services sociaux de se déplacer. Les sociétés de transport du Québec ont accentué la fréquence de l’entretien de leurs véhicules et installations. Les usagers sont tout de même invités à appliquer les consignes sanitaires habituelles et à conserver, dans la mesure du possible, une distance de deux mètres avec les autres personnes pr"
0,quelle est la température critique?,"Le coronavirus (COVID‑19) peut vivre sur les objets et surfaces. Sa durée de vie est de : *   3 heures sur les objets avec surfaces sèches; *   6 jours sur les objets avec surfaces humides. Il est donc important que vous laviez les comptoirs, les lavabos, les poignées de porte et toutes les surfaces fréquemment touchées par les mains. Le nettoyage et la désinfection sont très efficaces pour éliminer le virus. *   Pour nettoyer, utilisez de l’eau et du savon ou des produits de nettoyage a"
0,"pas de trans port en commun dans ma region , le covoiturage est il possible ?","Les services de transport en commun demeurent opérationnels et représentent un service essentiel pour permettre, notamment, au personnel du réseau de la santé et des services sociaux de se déplacer. Les sociétés de transport du Québec ont accentué la fréquence de l’entretien de leurs véhicules et installations. Les usagers sont tout de même invités à appliquer les consignes sanitaires habituelles et à conserver, dans la mesure du possible, une distance de deux mètres avec les autres personnes pr"
0,c'est quoi le covid,"En décembre 2019, l'Organisation mondiale de la Santé a été alertée de plusieurs cas de pneumonie à Wuhan, en Chine. Le virus responsable de la maladie ne correspondait à aucun autre virus connu. Le 7 janvier 2020, la Chine a confirmé avoir détecté un nouveau virus de la famille des coronavirus responsable de cette nouvelle maladie nommée la COVID‑19. Pour en savoir plus, consultez la page sur la [Situation du coronavirus (COVID‑19) au Québec](https://www.quebec.ca/sante/problemes-de-sante/a-z/c"
0,toilettage,"Les établissements des secteurs économiques suivants pourront rouvrir : *   l’ensemble des secteurs de l’industrie de la construction; *   les commerces de détail (établissements avec un accès extérieur habituellement utilisé par la clientèle) ainsi que leur chaîne d’approvisionnement; *   les entreprises du secteur manufacturier. Pour connaître les dates et modalités encadrant ces réouvertures, consultez la page [Reprise graduelle des activités en lien avec les mesures de ralentissement de la C"
0,What's the covid?,"Les principaux symptômes de la COVID‑19 sont les suivants : *   fièvre :     *   chez l’enfant : 38 °C (100,4 °F) et plus (température rectale),     *   chez l’adulte : 38 °C (100,4 °F) et plus (température buccale),     *   chez la personne aînée : 37,8 °C (100 °F) et plus (température buccale),     *   ou 1,1 °C de plus que la valeur habituelle d’une personne; *   apparition ou aggravation d’une toux; *   difficultés respiratoires; *   chez l’enfant : 38 °C (100,4 °F) et plus (température rect"
0,entre voisin est -il permis pour commision,"Si vous ou votre enfant avez des irritations de la peau ou une réaction allergique ou inflammatoire de la peau lorsque vous vous lavez les mains avec du gel hydroalcoolique, veuillez cesser l’utilisation de ce produit. Utilisez plutôt de l’eau et du savon pour vous laver les mains. Le lavage fréquent des mains et le lavage des mains avec du gel hydroalcoolique peuvent causer une sécheresse de la peau. Afin de prévenir cette sécheresse, il est recommandé d’appliquer de la crème hydratante sur les"
0,"bonjour  je suis de la region de l estrie, j ai une terre a bois ",Consultez la politique de la plateforme d’hébergement collaboratif en question. La plupart ont convenu de mesures de soutien en lien avec la crise sanitaire actuelle ou prévoient des clauses pour force ma
