Question,Bot
1,est-ce que j'ai la covid?,"Les principaux symptômes de la COVID‑19 sont les suivants : *   fièvre :     *   chez l’enfant : 38 °C (100,4 °F) et plus (température rectale),     *   chez l’adulte : 38 °C (100,4 °F) et plus (température buccale),     *   chez la personne aînée : 37,8 °C (100 °F) et plus (température buccale),     *   ou 1,1 °C de plus que la valeur habituelle d’une personne; *   apparition ou aggravation d’une toux; *   difficultés respiratoires; *   chez l’enfant : 38 °C (100,4 °F) et plus (température rect"
1,existe-t-il un vaccin?,"Des médicaments en vente libre peuvent être utilisés pour soulager les symptômes de la maladie à coronavirus (COVID‑19). Avant d’en faire usage, lisez attentivement les étiquettes et respectez les doses recommandées. **Il est fortement recommandé de demander conseil à votre pharmacien** avant d’utiliser des médicaments en vente libre en présence de symptômes. Évitez de prendre en même temps des produits qui contiennent les mêmes ingrédients comme du Tylenol MD et du Tylenol sinus"
1,dois-je laver mes légumes?,"Concernant les **lieux de cultes**, tous les rassemblements religieux de quelque confession que ce soit devront idéalement être suspendus, à moins d'être essentiels. Dans ce cas, la distanciation physique devra être obs"
1,est-ce que la saaq est ouverte?,*   [Société de l'assurance automobile du Québec (SAAQ)](https://saaq.gouv.qc.ca/salle-de-presse/covid-19-foire-aux-quest
1,est-ce que je suis à risque,Toute personne ayant fréquenté tout lieu public doit surveiller ses symptômes et respecter les consignes sanitaires suivantes : *   [Lavez-vous les mains](https://www.quebec.ca/sante/conseils-et-prevention/prevention-des-accidents-des-lesions-et-des-maladies/lavage-des-mains/) souvent à l'eau tiède courante et au savon pendant au moins 20 secondes. *   Utilisez un désinfectant à base d'alcool si vous n'avez pas accès à de l'eau et à du savon. *   Observez les règles d'hygiène lorsque vous tousse
1,quel est le site pour acheter local ?,"Concernant les **lieux de cultes**, tous les rassemblements religieux de quelque confession que ce soit devront idéalement être suspendus, à moins d'être essentiels. Dans ce cas, la distanciation physique devra être obs"
1,puis-je ouvrir mon camping?,Consultez la politique de la plateforme d’hébergement collaboratif en question. La plupart ont convenu de mesures de soutien en lien avec la crise sanitaire actuelle ou prévoient des clauses pour force ma
1,quand sera prêt le vaccin contre la covid-19?,"Des médicaments en vente libre peuvent être utilisés pour soulager les symptômes de la maladie à coronavirus (COVID‑19). Avant d’en faire usage, lisez attentivement les étiquettes et respectez les doses recommandées. **Il est fortement recommandé de demander conseil à votre pharmacien** avant d’utiliser des médicaments en vente libre en présence de symptômes. Évitez de prendre en même temps des produits qui contiennent les mêmes ingrédients comme du Tylenol MD et du Tylenol sinus"
1,je pense avoir la covid,"Les principaux symptômes de la COVID‑19 sont les suivants : *   fièvre :     *   chez l’enfant : 38 °C (100,4 °F) et plus (température rectale),     *   chez l’adulte : 38 °C (100,4 °F) et plus (température buccale),     *   chez la personne aînée : 37,8 °C (100 °F) et plus (température buccale),     *   ou 1,1 °C de plus que la valeur habituelle d’une personne; *   apparition ou aggravation d’une toux; *   difficultés respiratoires; *   chez l’enfant : 38 °C (100,4 °F) et plus (température rect"
1,je fais de la fièvre c'est normal,"Les principaux symptômes de la COVID‑19 sont les suivants : *   fièvre :     *   chez l’enfant : 38 °C (100,4 °F) et plus (température rectale),     *   chez l’adulte : 38 °C (100,4 °F) et plus (température buccale),     *   chez la personne aînée : 37,8 °C (100 °F) et plus (température buccale),     *   ou 1,1 °C de plus que la valeur habituelle d’une personne; *   apparition ou aggravation d’une toux; *   difficultés respiratoires; *   chez l’enfant : 38 °C (100,4 °F) et plus (température rect"
1,comment se protéger du covid-19,"Le coronavirus (COVID‑19) peut vivre sur les objets et surfaces. Sa durée de vie est de quelques heures à plusieurs jours. Cela dépend notamment du type de surface (par exemple : cuivre, carton, acier inoxydable, plastique), de la température et de l’humidité ambiante. Il est donc important que vous laviez les comptoirs, les lavabos, les poignées de porte et toutes les surfaces fréquemment touchées par les mains. Le nettoyage et la désinfection sont très efficaces pour éliminer le virus. "
1,recommandations pour les autobus ,"Les services de transport en commun demeurent opérationnels et représentent un service essentiel pour permettre, notamment, au personnel du réseau de la santé et des services sociaux de se déplacer. Les sociétés de transport du Québec ont accentué la fréquence de l’entretien de leurs véhicules et installations. Les usagers sont tout de même invités à appliquer les consignes sanitaires habituelles et à conserver, dans la mesure du possible, une distance de deux mètres avec les autres personnes pr"
1,est-ce que ma mes amis peuvent m’aider à déménager ,"Les services de transport en commun demeurent opérationnels et représentent un service essentiel pour permettre, notamment, au personnel du réseau de la santé et des services sociaux de se déplacer. Les sociétés de transport du Québec ont accentué la fréquence de l’entretien de leurs véhicules et installations. Les usagers sont tout de même invités à appliquer les consignes sanitaires habituelles et à conserver, dans la mesure du possible, une distance de deux mètres avec les autres personnes pr"
1,présence d'un client qui tousse dans mon commerce,Consultez la [liste des services et activités prioritaires](https://www.quebec.ca/sante/problemes-de-sante/a-z/coronavirus-2019/fermeture-endroits-publics-commerces-services-covi
1,quand ouverture entreprise ,"Ces changements sont en vigueur et seront réévalués au 31 mai 2020. Le gouvernement du Québec invite la population à rester à l’affût. Les pharmacies, les épiceries et les autres commerces d’alimentation ainsi que les établissements offrant des services d’épicerie ou de pharmacie en dehors des centres commerciaux pourront continuer d’étendre leurs heures d’ouverture au-delà des périodes légales du lundi au samedi jusqu’au 31 mai 2020. Aucune restriction quant au nombre d’employés présents pour a"
1,mon stage vas tu etre annul.é,"Lorsque les milieux de stage ont confirmé la continuité de leurs services, que les étudiants évoluent dans un endroit où les consignes de la Santé publique sont respectées et que les étudiants peuvent réaliser leur stage, par exemple en recourant au télétravail, les stages sont possibles. Cependant, aucun étudiant ne peut être pénalisé en raison de son incapacité à répondre aux exig"
1,comment dénoncer des comportements inacceptables,"Il est demandé aux citoyens de ne pas composer le 911 pour dénoncer un rassemblement afin d’éviter d’engorger les lignes téléphoniques des centres d'urgence 911. Si vous êtes témoin d’une situation sérieuse qui nécessite une intervention policière, vous pouvez communiquer avec le [service de police qui dessert votre territoire](https://www.securitepublique.gouv.qc.ca/police/bottin.html) . La sensibilisation et l’information sont les approches privilégiées par l’ensemble des corps policiers au Qu"
1,est-ce que je peux continuer à utiliser le transport en commun?,"Les services de transport en commun demeurent opérationnels et représentent un service essentiel pour permettre, notamment, au personnel du réseau de la santé et des services sociaux de se déplacer. Les sociétés de transport du Québec ont accentué la fréquence de l’entretien de leurs véhicules et installations. Les usagers sont tout de même invités à appliquer les consignes sanitaires habituelles et à conserver, dans la mesure du possible, une distance de deux mètres avec les autres personnes pr"
1,quels sont les symptômes?,"Des médicaments en vente libre peuvent être utilisés pour soulager les symptômes de la maladie à coronavirus (COVID‑19). Avant d’en faire usage, lisez attentivement les étiquettes et respectez les doses recommandées. **Il est fortement recommandé de demander conseil à votre pharmacien** avant d’utiliser des médicaments en vente libre en présence de symptômes. Évitez de prendre en même temps des produits qui contiennent les mêmes ingrédients comme du Tylenol MD et du Tylenol sinus"
1,est-ce que mon chien peut me transmettre le covid-19?,"Des médicaments en vente libre peuvent être utilisés pour soulager les symptômes de la maladie à coronavirus (COVID‑19). Avant d’en faire usage, lisez attentivement les étiquettes et respectez les doses recommandées. **Il est fortement recommandé de demander conseil à votre pharmacien** avant d’utiliser des médicaments en vente libre en présence de symptômes. Évitez de prendre en même temps des produits qui contiennent les mêmes ingrédients comme du Tylenol MD et du Tylenol sinus"
1,c'est quoi le covid-19 ?,Toute personne ayant fréquenté tout lieu public doit surveiller ses symptômes et respecter les consignes sanitaires suivantes : *   [Lavez-vous les mains](https://www.quebec.ca/sante/conseils-et-prevention/prevention-des-accidents-des-lesions-et-des-maladies/lavage-des-mains/) souvent à l'eau tiède courante et au savon pendant au moins 20 secondes. *   Utilisez un désinfectant à base d'alcool si vous n'avez pas accès à de l'eau et à du savon. *   Observez les règles d'hygiène lorsque vous tousse
1,je me sens pas bien que faire?,"Dans un contexte de pandémie, de nombreuses personnes vivront des réactions de stress, d’anxiété et de déprime. Pour vous aider à minimiser les répercussions de telles réactions dans votre vie, consultez la page [Stress, anxiété et déprime associés à la maladie à coronavirus COVID‑19](https://www.quebec.ca/sante/problemes-de-sante/a-z/coronavirus-2019/stress-anxiete-et-deprime-associes-a-la-maladie-a-coronavirus-covid-19/). Aucun traitement spécifique ni vaccin n’existe pour la COVID‑19. Des tra"
1,c'est quoi le covid-19,Toute personne ayant fréquenté tout lieu public doit surveiller ses symptômes et respecter les consignes sanitaires suivantes : *   [Lavez-vous les mains](https://www.quebec.ca/sante/conseils-et-prevention/prevention-des-accidents-des-lesions-et-des-maladies/lavage-des-mains/) souvent à l'eau tiède courante et au savon pendant au moins 20 secondes. *   Utilisez un désinfectant à base d'alcool si vous n'avez pas accès à de l'eau et à du savon. *   Observez les règles d'hygiène lorsque vous tousse
1,est-ce qu'il y a un risque de transmission avec la nourriture? ,"Concernant les **lieux de cultes**, tous les rassemblements religieux de quelque confession que ce soit devront idéalement être suspendus, à moins d'être essentiels. Dans ce cas, la distanciation physique devra être obs"
1,est-ce que la chasse et la pêche sont permises,"Les dates pour l’ouverture des saisons de chasse et de pêche sont maintenues, mais les amateurs de chasse et de pêche seront tenus de respecter les interdictions gouvernementales. Ainsi, ils devront se conformer en tout temps aux directives et recommandations de la Direction nationale de la santé publique visant à endiguer l’épidémie de COVID-19, notamment : *   Éviter de se déplacer d’une région ou d’une ville à l’autre, sauf en cas de nécessité. Les déplacements en lien avec les loisirs ne son"
1,suis-je contagieux,Toute personne ayant fréquenté tout lieu public doit surveiller ses symptômes et respecter les consignes sanitaires suivantes : *   [Lavez-vous les mains](https://www.quebec.ca/sante/conseils-et-prevention/prevention-des-accidents-des-lesions-et-des-maladies/lavage-des-mains/) souvent à l'eau tiède courante et au savon pendant au moins 20 secondes. *   Utilisez un désinfectant à base d'alcool si vous n'avez pas accès à de l'eau et à du savon. *   Observez les règles d'hygiène lorsque vous tousse
1,"je suis malade, où dois-je appeler?",Toute personne ayant fréquenté tout lieu public doit surveiller ses symptômes et respecter les consignes sanitaires suivantes : *   [Lavez-vous les mains](https://www.quebec.ca/sante/conseils-et-prevention/prevention-des-accidents-des-lesions-et-des-maladies/lavage-des-mains/) souvent à l'eau tiède courante et au savon pendant au moins 20 secondes. *   Utilisez un désinfectant à base d'alcool si vous n'avez pas accès à de l'eau et à du savon. *   Observez les règles d'hygiène lorsque vous tousse
1,dois-je absolument porter un masque?,"Le port du couvre-visage est recommandé dans les lieux publics lorsque la distanciation physique n'est pas possible. Cela peut se produire, par exemple, en se rendant à l’épicerie ou en prenant le transport en commun. Le port du couvre-visage dans les lieux publics doit obligatoirement s’accompagner des autres mesures de protection, comme l’application des mesures d’hygiène et de distanciation physique. Pour en savoir plus, consultez la section [Consignes sanitaire pour tous](https://www.quebec."
1,présence d'un client qui tousse dans mon commerce,"Il est de la responsabilité du propriétaire de l’établissement de prendre les mesures qu'il juge nécessaires pour préserver la santé publique dans son restaurant ou de son épicerie. Toutefois, ce n’est pas parce qu’une personne tousse qu’elle est infectée par le virus. Nous comptons sur le civisme et l’honnêteté des citoyens pour respecter les consignes de santé publique en cas de doute ou de contamin"
1,est-ce que mon animal de compagnie peut me transmettre le covid-19?,"Des médicaments en vente libre peuvent être utilisés pour soulager les symptômes de la maladie à coronavirus (COVID‑19). Avant d’en faire usage, lisez attentivement les étiquettes et respectez les doses recommandées. **Il est fortement recommandé de demander conseil à votre pharmacien** avant d’utiliser des médicaments en vente libre en présence de symptômes. Évitez de prendre en même temps des produits qui contiennent les mêmes ingrédients comme du Tylenol MD et du Tylenol sinus"
1,symptômes du covid,"Les principaux symptômes de la COVID‑19 sont les suivants : *   fièvre :     *   chez l’enfant : 38 °C (100,4 °F) et plus (température rectale),     *   chez l’adulte : 38 °C (100,4 °F) et plus (température buccale),     *   chez la personne aînée : 37,8 °C (100 °F) et plus (température buccale),     *   ou 1,1 °C de plus que la valeur habituelle d’une personne; *   apparition ou aggravation d’une toux; *   difficultés respiratoires; *   chez l’enfant : 38 °C (100,4 °F) et plus (température rect"
1,comment se promène le covid-19?,Toute personne ayant fréquenté tout lieu public doit surveiller ses symptômes et respecter les consignes sanitaires suivantes : *   [Lavez-vous les mains](https://www.quebec.ca/sante/conseils-et-prevention/prevention-des-accidents-des-lesions-et-des-maladies/lavage-des-mains/) souvent à l'eau tiède courante et au savon pendant au moins 20 secondes. *   Utilisez un désinfectant à base d'alcool si vous n'avez pas accès à de l'eau et à du savon. *   Observez les règles d'hygiène lorsque vous tousse
1,est-ce qu'il y a un risque de transmission avec la nourriture? ,"Des médicaments en vente libre peuvent être utilisés pour soulager les symptômes de la maladie à coronavirus (COVID‑19). Avant d’en faire usage, lisez attentivement les étiquettes et respectez les doses recommandées. **Il est fortement recommandé de demander conseil à votre pharmacien** avant d’utiliser des médicaments en vente libre en présence de symptômes. Évitez de prendre en même temps des produits qui contiennent les mêmes ingrédients comme du Tylenol MD et du Tylenol sinus"
1,est-ce que mon chien peut attraper le covid-19,"Des médicaments en vente libre peuvent être utilisés pour soulager les symptômes de la maladie à coronavirus (COVID‑19). Avant d’en faire usage, lisez attentivement les étiquettes et respectez les doses recommandées. **Il est fortement recommandé de demander conseil à votre pharmacien** avant d’utiliser des médicaments en vente libre en présence de symptômes. Évitez de prendre en même temps des produits qui contiennent les mêmes ingrédients comme du Tylenol MD et du Tylenol sinus"
1,pourquoi le covid-19 tue,"Les principaux symptômes de la COVID‑19 sont les suivants : *   fièvre :     *   chez l’enfant : 38 °C (100,4 °F) et plus (température rectale),     *   chez l’adulte : 38 °C (100,4 °F) et plus (température buccale),     *   chez la personne aînée : 37,8 °C (100 °F) et plus (température buccale),     *   ou 1,1 °C de plus que la valeur habituelle d’une personne; *   apparition ou aggravation d’une toux; *   difficultés respiratoires; *   chez l’enfant : 38 °C (100,4 °F) et plus (température rect"
1,est-ce que je suis contagieux,"Dans un contexte de pandémie, de nombreuses personnes vivront des réactions de stress, d’anxiété et de déprime. Pour vous aider à minimiser les répercussions de telles réactions dans votre vie, consultez la page [Stress, anxiété et déprime associés à la maladie à coronavirus COVID‑19](https://www.quebec.ca/sante/problemes-de-sante/a-z/coronavirus-2019/stress-anxiete-et-deprime-associes-a-la-maladie-a-coronavirus-covid-19/). Aucun traitement spécifique ni vaccin n’existe pour la COVID‑19. Des tra"
1,que dois-je faire si je vois un regroupement de personnes?,"Il est demandé aux citoyens de ne pas composer le 911 pour dénoncer un rassemblement afin d’éviter d’engorger les lignes téléphoniques des centres d'urgence 911. Si vous êtes témoin d’une situation sérieuse qui nécessite une intervention policière, vous pouvez communiquer avec le [service de police qui dessert votre territoire](https://www.securitepublique.gouv.qc.ca/police/bottin.html) . La sensibilisation et l’information sont les approches privilégiées par l’ensemble des corps policiers au Qu"
1,existe-t-il un médicament?,"Il n'existe pas de traitement spécifique ni de vaccin pour la COVID‑19 pour l’instant. La plupart des personnes atteintes du virus se rétablissent par elles-mêmes en restant à la maison, sans avoir besoin d’aller à l’hôpital. Toutefois, les personnes infectées par le virus, surtout celles qui sont gravement malades, doivent recevoir des soins particuliers pour soulager et traiter les symptômes. Par exemple, il peut être nécessaire de leur administrer de l’acétaminophène en cas de fièvre, de l’ox"
1,comment nettoyer mes légumes,"Concernant les **lieux de cultes**, tous les rassemblements religieux de quelque confession que ce soit devront idéalement être suspendus, à moins d'être essentiels. Dans ce cas, la distanciation physique devra être obs"
1,est-ce que la saaq est ouverte?,*   [Société de l'assurance automobile du Québec (SAAQ)](https://saaq.gouv.qc.ca/salle-de-presse/covid-19-foire-aux-quest
1,est-ce qu'une personne peut en décéder?,"Des médicaments en vente libre peuvent être utilisés pour soulager les symptômes de la maladie à coronavirus (COVID‑19). Avant d’en faire usage, lisez attentivement les étiquettes et respectez les doses recommandées. **Il est fortement recommandé de demander conseil à votre pharmacien** avant d’utiliser des médicaments en vente libre en présence de symptômes. Évitez de prendre en même temps des produits qui contiennent les mêmes ingrédients comme du Tylenol MD et du Tylenol sinus"
1,le port du masque est-il efficace?,"Le port du couvre-visage est recommandé dans les lieux publics lorsque la distanciation physique n'est pas possible. Cela peut se produire, par exemple, en se rendant à l’épicerie ou en prenant le transport en commun. Le port du couvre-visage dans les lieux publics doit obligatoirement s’accompagner des autres mesures de protection, comme l’application des mesures d’hygiène et de distanciation physique. Pour en savoir plus, consultez la section [Consignes sanitaire pour tous](https://www.quebec."
1,est-ce que les hôtels sont ouverts ?,Consultez la politique de la plateforme d’hébergement collaboratif en question. La plupart ont convenu de mesures de soutien en lien avec la crise sanitaire actuelle ou prévoient des clauses pour force ma
1,ai-je droit aux services de garde?,Consultez la [liste des services et activités prioritaires](https://www.quebec.ca/sante/problemes-de-sante/a-z/coronavirus-2019/fermeture-endroits-publics-commerces-services-covi
1,le covid-19 survie combien de temps sur les surfaces?,"Des médicaments en vente libre peuvent être utilisés pour soulager les symptômes de la maladie à coronavirus (COVID‑19). Avant d’en faire usage, lisez attentivement les étiquettes et respectez les doses recommandées. **Il est fortement recommandé de demander conseil à votre pharmacien** avant d’utiliser des médicaments en vente libre en présence de symptômes. Évitez de prendre en même temps des produits qui contiennent les mêmes ingrédients comme du Tylenol MD et du Tylenol sinus"
1,comment se protéger de la covid-19?,Toute personne ayant fréquenté tout lieu public doit surveiller ses symptômes et respecter les consignes sanitaires suivantes : *   [Lavez-vous les mains](https://www.quebec.ca/sante/conseils-et-prevention/prevention-des-accidents-des-lesions-et-des-maladies/lavage-des-mains/) souvent à l'eau tiède courante et au savon pendant au moins 20 secondes. *   Utilisez un désinfectant à base d'alcool si vous n'avez pas accès à de l'eau et à du savon. *   Observez les règles d'hygiène lorsque vous tousse
1,puis-je inviter des amis à souper?,"Des médicaments en vente libre peuvent être utilisés pour soulager les symptômes de la maladie à coronavirus (COVID‑19). Avant d’en faire usage, lisez attentivement les étiquettes et respectez les doses recommandées. **Il est fortement recommandé de demander conseil à votre pharmacien** avant d’utiliser des médicaments en vente libre en présence de symptômes. Évitez de prendre en même temps des produits qui contiennent les mêmes ingrédients comme du Tylenol MD et du Tylenol sinus"
1,ou je dois appeler si j’ai des symptômes covid?,Toute personne ayant fréquenté tout lieu public doit surveiller ses symptômes et respecter les consignes sanitaires suivantes : *   [Lavez-vous les mains](https://www.quebec.ca/sante/conseils-et-prevention/prevention-des-accidents-des-lesions-et-des-maladies/lavage-des-mains/) souvent à l'eau tiède courante et au savon pendant au moins 20 secondes. *   Utilisez un désinfectant à base d'alcool si vous n'avez pas accès à de l'eau et à du savon. *   Observez les règles d'hygiène lorsque vous tousse
1,existe -t-il un remède ?,"Il n'existe pas de traitement spécifique ni de vaccin pour la COVID‑19 pour l’instant. La plupart des personnes atteintes du virus se rétablissent par elles-mêmes en restant à la maison, sans avoir besoin d’aller à l’hôpital. Toutefois, les personnes infectées par le virus, surtout celles qui sont gravement malades, doivent recevoir des soins particuliers pour soulager et traiter les symptômes. Par exemple, il peut être nécessaire de leur administrer de l’acétaminophène en cas de fièvre, de l’ox"
1,c'est quoi la covid-19?,"En décembre 2019, l'Organisation mondiale de la Santé a été alertée de plusieurs cas de pneumonie à Wuhan, en Chine. Le virus responsable de la maladie ne correspondait à aucun autre virus connu. Le 7 janvier 2020, la Chine a confirmé avoir détecté un nouveau virus de la famille des coronavirus responsable de cette nouvelle maladie nommée la COVID‑19. Pour en savoir plus, consultez la page sur la [Situation du coronavirus (COVID‑19) au Québec](https://www.quebec.ca/sante/problemes-de-sante/a-z/c"
1,est-ce que mes amis peuvent m'aider à déménager?,"Les services de transport en commun demeurent opérationnels et représentent un service essentiel pour permettre, notamment, au personnel du réseau de la santé et des services sociaux de se déplacer. Les sociétés de transport du Québec ont accentué la fréquence de l’entretien de leurs véhicules et installations. Les usagers sont tout de même invités à appliquer les consignes sanitaires habituelles et à conserver, dans la mesure du possible, une distance de deux mètres avec les autres personnes pr"
1,c'est quoi le covid-19 covid-19?,"Les principaux symptômes de la COVID‑19 sont les suivants : *   fièvre :     *   chez l’enfant : 38 °C (100,4 °F) et plus (température rectale),     *   chez l’adulte : 38 °C (100,4 °F) et plus (température buccale),     *   chez la personne aînée : 37,8 °C (100 °F) et plus (température buccale),     *   ou 1,1 °C de plus que la valeur habituelle d’une personne; *   apparition ou aggravation d’une toux; *   difficultés respiratoires; *   chez l’enfant : 38 °C (100,4 °F) et plus (température rect"
